# producthunt cohort | topic=artificial-intelligence | 2022-01-01T00:00:00Z..2024-01-01T00:00:00Z | n=1260 | label=votesCount(buzz proxy)
id,name,tagline,description,topics,createdAt,votesCount,commentsCount,website,url
"432217","Animalia AI","Chat with animals using AI","I built this site back in March for fun and kept it from the public for most of the year, but every time I showed it in person people seemed to like the idea so wanted to put it out there for others to play around with as well.","Artificial Intelligence","2023-12-31T22:12:53Z","1","0","https://www.producthunt.com/r/VBPL7MI3BFNV6N?utm_campaign=producthunt-api&utm_medium=api-v2&utm_source=Application%3A+RL+search+%28ID%3A+290620%29","https://www.producthunt.com/products/animalia-ai/launches/animalia-ai?utm_campaign=producthunt-api&utm_medium=api-v2&utm_source=Application%3A+RL+search+%28ID%3A+290620%29"
"432210","Knitetech.io","Oneness of Innovation","Why Knitetech oim? Ditch the AI tool overload! Picture one platform for all your needs—it's your digital peanut butter AND jelly. Simplify your life with #KnitetechAI&nbsp;🤖✨""","Productivity|SaaS|Artificial Intelligence","2023-12-31T18:30:00Z","13","13","https://www.producthunt.com/r/WSHMHQ7D3XVSFC?utm_campaign=producthunt-api&utm_medium=api-v2&utm_source=Application%3A+RL+search+%28ID%3A+290620%29","https://www.producthunt.com/products/knitetech-io/launches/knitetech-io?utm_campaign=producthunt-api&utm_medium=api-v2&utm_source=Application%3A+RL+search+%28ID%3A+290620%29"
"432209","Newscadia","News Reimagined: AI-Organized Topics, Socially Engaged","Newscadia delivers a one-stop ML-powered platform that consolidates real-time news from thousands of sources worldwide. Dive Deep, Miss Nothing.","News|Artificial Intelligence","2023-12-31T17:22:22Z","4","1","https://www.producthunt.com/r/LAUV5HQKXBG4HL?utm_campaign=producthunt-api&utm_medium=api-v2&utm_source=Application%3A+RL+search+%28ID%3A+290620%29","https://www.producthunt.com/products/newscadia/launches/newscadia?utm_campaign=producthunt-api&utm_medium=api-v2&utm_source=Application%3A+RL+search+%28ID%3A+290620%29"
"432122","MagicRecap","Your Daily Summarizing Assistant","MagicRecap is a friendly summarization assistant to help you in saving your precious time by allowing you to summarize hours and hours of content into a small and easy to read summary.","News|Writing|Artificial Intelligence","2023-12-31T16:01:00Z","2","1","https://www.producthunt.com/r/KH26UDSLG5BYRP?utm_campaign=producthunt-api&utm_medium=api-v2&utm_source=Application%3A+RL+search+%28ID%3A+290620%29","https://www.producthunt.com/products/magicrecap/launches/magicrecap?utm_campaign=producthunt-api&utm_medium=api-v2&utm_source=Application%3A+RL+search+%28ID%3A+290620%29"
"432110","UserWise","Gain insights from feedback to make data-driven decisions","Userwise: AI tool for businesses to gather, analyze, & act on customer feedback. It automatically detects sentiment, summarizes insights, tracks trends, collects from multiple channels, and aids data-driven decisions.","SaaS|Artificial Intelligence|CRM","2023-12-31T08:04:08Z","297","148","https://www.producthunt.com/r/5ASQTCEXTPRKKQ?utm_campaign=producthunt-api&utm_medium=api-v2&utm_source=Application%3A+RL+search+%28ID%3A+290620%29","https://www.producthunt.com/products/userwise-feedback-management-platform/launches/userwise-2?utm_campaign=producthunt-api&utm_medium=api-v2&utm_source=Application%3A+RL+search+%28ID%3A+290620%29"
"432157","Bot or Not","Can AI Fool You?","Try and tell the difference between AI generated and human content. Test your skills on speech, music, faces, and much more.","Funny|Free Games|Artificial Intelligence","2023-12-31T08:01:00Z","2","1","https://www.producthunt.com/r/2S464BU6THG2QA?utm_campaign=producthunt-api&utm_medium=api-v2&utm_source=Application%3A+RL+search+%28ID%3A+290620%29","https://www.producthunt.com/products/bot-or-not-4/launches/bot-or-not-4?utm_campaign=producthunt-api&utm_medium=api-v2&utm_source=Application%3A+RL+search+%28ID%3A+290620%29"
"432144","Scrabblecam","Recognize Scrabble board photos and find best possible moves","Scrabblecam is an AI website for finding best moves from photos of real Scrabble boards. It uses state of the art Deep Learning algorithms to achieve best accuracy. APIs for board recognition and top moves generation are also available for developers.","Board Games|Word Games|Artificial Intelligence","2023-12-31T08:01:00Z","2","1","https://www.producthunt.com/r/HSJCJYQD4M46SB?utm_campaign=producthunt-api&utm_medium=api-v2&utm_source=Application%3A+RL+search+%28ID%3A+290620%29","https://www.producthunt.com/products/scrabblecam/launches/scrabblecam?utm_campaign=producthunt-api&utm_medium=api-v2&utm_source=Application%3A+RL+search+%28ID%3A+290620%29"
"432089","FindPic.io - Free Beautiful Stock Photos","AI version of Unsplash , all the images are generated by AI","Unlimited free beautiful stock photos and images. An AI version of Unsplash all the images are generated by AI","Photography|Artificial Intelligence|Photo & Video","2023-12-31T08:01:00Z","5","0","https://www.producthunt.com/r/JGNSC4B7WP7B4N?utm_campaign=producthunt-api&utm_medium=api-v2&utm_source=Application%3A+RL+search+%28ID%3A+290620%29","https://www.producthunt.com/products/findpic-io-free-beautiful-stock-photos/launches/findpic-io-free-beautiful-stock-photos?utm_campaign=producthunt-api&utm_medium=api-v2&utm_source=Application%3A+RL+search+%28ID%3A+290620%29"
"432130","Findrr","The First Ai Tattoo Designer","Write your wildest tattoo ideas, and then use Findrr to transform it into a custom design. Get Tattoo design inspiration and new ideas for your tattoo.","Artificial Intelligence","2023-12-30T20:40:09Z","14","5","https://www.producthunt.com/r/F4HRJN4HVEHKED?utm_campaign=producthunt-api&utm_medium=api-v2&utm_source=Application%3A+RL+search+%28ID%3A+290620%29","https://www.producthunt.com/products/findrr/launches/findrr-1?utm_campaign=producthunt-api&utm_medium=api-v2&utm_source=Application%3A+RL+search+%28ID%3A+290620%29"
"432109","Next Move Strategy Consulting","Enabling Business Growth Through Market Insights","Next Move Strategy Consulting is a premier market research and management consulting firm that has been committed to provide strategically analysed well documented latest research reports to its clients.","Analytics|SaaS|Artificial Intelligence","2023-12-30T12:35:57Z","0","0","https://www.producthunt.com/r/7YD4Z5JWTPPNKJ?utm_campaign=producthunt-api&utm_medium=api-v2&utm_source=Application%3A+RL+search+%28ID%3A+290620%29","https://www.producthunt.com/products/next-move-strategy-consulting/launches/next-move-strategy-consulting?utm_campaign=producthunt-api&utm_medium=api-v2&utm_source=Application%3A+RL+search+%28ID%3A+290620%29"
"432102","Brain Cloud Flashcards","Tech Swag for the AWS","Brain Cloud's ebook originates from the material curated for Cloud Flashcards for AWS and compiles information from multiple sources to generate descriptions for cloud services and products.","Amazon|Education|Artificial Intelligence|Tech","2023-12-30T10:16:33Z","1","1","https://www.producthunt.com/r/TYN4HZYMOCWX5B?utm_campaign=producthunt-api&utm_medium=api-v2&utm_source=Application%3A+RL+search+%28ID%3A+290620%29","https://www.producthunt.com/products/brain-cloud-flashcards/launches/brain-cloud-flashcards?utm_campaign=producthunt-api&utm_medium=api-v2&utm_source=Application%3A+RL+search+%28ID%3A+290620%29"
"431094","Impakt: AI Coach","Train smarter, not harder","Experience the future of fitness with a true AI Coach in your pocket. Train smarter, not harder! Analyze all your reps and maximize your fitness efficiency. Being healthy & fit has never been so fun, social and easy. All you need to do is show up..","Health & Fitness|Social Media|Artificial Intelligence|Web3","2023-12-30T09:16:14Z","441","119","https://www.producthunt.com/r/WQ72MDQMSTOHKF?utm_campaign=producthunt-api&utm_medium=api-v2&utm_source=Application%3A+RL+search+%28ID%3A+290620%29","https://www.producthunt.com/products/impakt-ai-coach/launches/impakt-ai-coach?utm_campaign=producthunt-api&utm_medium=api-v2&utm_source=Application%3A+RL+search+%28ID%3A+290620%29"
"431928","Laterbase","Save, search and chat with your bookmarks using AI","Meet Laterbase - an AI-powered bookmark manager that goes beyond simple organization. Chat directly with your bookmarks to quickly retrieve information and extract key insights, ensuring you never miss what's important.","Productivity|Artificial Intelligence|Tech","2023-12-30T08:35:35Z","184","29","https://www.producthunt.com/r/J5TL35HK6YYRUM?utm_campaign=producthunt-api&utm_medium=api-v2&utm_source=Application%3A+RL+search+%28ID%3A+290620%29","https://www.producthunt.com/products/laterbase/launches/laterbase?utm_campaign=producthunt-api&utm_medium=api-v2&utm_source=Application%3A+RL+search+%28ID%3A+290620%29"
"432084","PowerTelegram","Use ChatGPT on Telegram","Use ChatGPT on Telegram","Robots|Artificial Intelligence|Bots","2023-12-30T08:29:28Z","1","1","https://www.producthunt.com/r/ADCOTAXW6GLMVM?utm_campaign=producthunt-api&utm_medium=api-v2&utm_source=Application%3A+RL+search+%28ID%3A+290620%29","https://www.producthunt.com/products/powertelegram/launches/powertelegram?utm_campaign=producthunt-api&utm_medium=api-v2&utm_source=Application%3A+RL+search+%28ID%3A+290620%29"
"432083","Tech Web Planet","Explore Best AI Tools Under One Site","Tech web planet is all about best ai tools of different category under one site which can help you to find best ai tool according to your profession","Internet of Things|Artificial Intelligence|Tech","2023-12-30T08:26:12Z","2","1","https://www.producthunt.com/r/WTVNMYGMJVCPY5?utm_campaign=producthunt-api&utm_medium=api-v2&utm_source=Application%3A+RL+search+%28ID%3A+290620%29","https://www.producthunt.com/products/tech-web-planet/launches/tech-web-planet?utm_campaign=producthunt-api&utm_medium=api-v2&utm_source=Application%3A+RL+search+%28ID%3A+290620%29"
"432063","MemeZoo","Make money by generating memes using AI","Create unique memes via AI prompts. Instantly sell your memes via print, NFT, or redeem your 'likes' for cash. Create for fun, or as a career. Currently in Beta.","Artificial Intelligence|Printing|Memes","2023-12-30T08:25:46Z","147","38","https://www.producthunt.com/r/DQ7FMOPEMAQAJ6?utm_campaign=producthunt-api&utm_medium=api-v2&utm_source=Application%3A+RL+search+%28ID%3A+290620%29","https://www.producthunt.com/products/memezoo/launches/memezoo?utm_campaign=producthunt-api&utm_medium=api-v2&utm_source=Application%3A+RL+search+%28ID%3A+290620%29"
"432076","Nextprep","An AI powered career advancement platform","Nextprep is an AI-powered career advancement platform. Nextprep allows you to walk through mock interviews that prepare you for the real deal. Using AI technology, we also provides you with post-interview reports which are available for you to reflect upon.","Artificial Intelligence|Online Learning|Career","2023-12-30T08:15:39Z","113","19","https://www.producthunt.com/r/ZBMOX7CWCWBTVD?utm_campaign=producthunt-api&utm_medium=api-v2&utm_source=Application%3A+RL+search+%28ID%3A+290620%29","https://www.producthunt.com/products/nextprep/launches/nextprep?utm_campaign=producthunt-api&utm_medium=api-v2&utm_source=Application%3A+RL+search+%28ID%3A+290620%29"
"420552","meed open beta","Enterprise-grade loyalty for independent and SME retail","meed is a loyalty solution for independent retail to earn more from your customers. Meed brings enterprise-grade push to mobile power to all business sizes for a low monthly subscription.","Marketing|SaaS|Artificial Intelligence","2023-12-30T08:01:00Z","3","2","https://www.producthunt.com/r/6H7HIG7KEJU6XQ?utm_campaign=producthunt-api&utm_medium=api-v2&utm_source=Application%3A+RL+search+%28ID%3A+290620%29","https://www.producthunt.com/products/meed/launches/meed-open-beta?utm_campaign=producthunt-api&utm_medium=api-v2&utm_source=Application%3A+RL+search+%28ID%3A+290620%29"
"431705","Midjourney Prime & Style","Craft amazing Midjourney images, powered by Notion & ChatGPT","The Ultimate companion for Midjourney image generation. → Consistently spectacular Midjourney images with a custom GPT → Instantly auto-generated image prompts with parameters. → All-in-one library manager in Notion","Design Tools|Artificial Intelligence|Notion","2023-12-30T08:01:00Z","16","4","https://www.producthunt.com/r/47IQWTTBV3ULIP?utm_campaign=producthunt-api&utm_medium=api-v2&utm_source=Application%3A+RL+search+%28ID%3A+290620%29","https://www.producthunt.com/products/midjourney-prime-style/launches/midjourney-prime-style-2?utm_campaign=producthunt-api&utm_medium=api-v2&utm_source=Application%3A+RL+search+%28ID%3A+290620%29"
"427400","StockmusicGPT: AI Stock Music Generator","Your Content Deserves Better Stock Music","Your content deserves better stock music, and we help make it happen. Whether you're a content creator, filmmaker, or just looking for unique background music, our app has you covered!","Music|SaaS|Artificial Intelligence","2023-12-30T08:01:00Z","1","1","https://www.producthunt.com/r/SR34OMJDWFCFSU?utm_campaign=producthunt-api&utm_medium=api-v2&utm_source=Application%3A+RL+search+%28ID%3A+290620%29","https://www.producthunt.com/products/stockmusicgpt/launches/stockmusicgpt-ai-stock-music-generator?utm_campaign=producthunt-api&utm_medium=api-v2&utm_source=Application%3A+RL+search+%28ID%3A+290620%29"
"432051","The Prompt Index","The #1 AI Resource","The Prompt Index is a website rammed full of resources, but it's also a weekly newsletter and more importantly a community that helps and supports each other via our telegram channel. Best of all, it's all FREE.","Newsletters|Artificial Intelligence|Community","2023-12-30T08:01:00Z","4","1","https://www.producthunt.com/r/7FZYT5FAMWZ3YU?utm_campaign=producthunt-api&utm_medium=api-v2&utm_source=Application%3A+RL+search+%28ID%3A+290620%29","https://www.producthunt.com/products/the-prompt-index/launches/the-prompt-index?utm_campaign=producthunt-api&utm_medium=api-v2&utm_source=Application%3A+RL+search+%28ID%3A+290620%29"
"432058","Gemini AI Chat","It is AI Chat, reply on google's gemini pro api","It is AI Chat, reply on google's gemini pro api. No login required, Simple operation.","Social Media|Artificial Intelligence|Bots","2023-12-30T08:01:00Z","6","1","https://www.producthunt.com/r/VQVOI5EWTXVU3B?utm_campaign=producthunt-api&utm_medium=api-v2&utm_source=Application%3A+RL+search+%28ID%3A+290620%29","https://www.producthunt.com/products/gemini-ai-chat/launches/gemini-ai-chat?utm_campaign=producthunt-api&utm_medium=api-v2&utm_source=Application%3A+RL+search+%28ID%3A+290620%29"
"432065","Free 3D Social Media Profiles Maker","Create viral 3D avatar from your photo. Powered by DALL-E 3.","Unleash the power of DALL-E 3 to transform your photo into a stunning 3D AI social media avatar! We analyze your image, craft a vivid description, and create a brand-new avatar that's bound to captivate your followers. Level up your online persona today. 🚀","Design Tools|Social Media|Artificial Intelligence","2023-12-30T08:01:00Z","10","3","https://www.producthunt.com/r/SYMZJ42MJ3XFXG?utm_campaign=producthunt-api&utm_medium=api-v2&utm_source=Application%3A+RL+search+%28ID%3A+290620%29","https://www.producthunt.com/products/fusionart-ai/launches/free-3d-social-media-profiles-maker?utm_campaign=producthunt-api&utm_medium=api-v2&utm_source=Application%3A+RL+search+%28ID%3A+290620%29"
"432077","Homelens X","Personal Real Estate Assistant","Homelens X is your personal real estate assistant. An free all-in-on app to simplify property management, save maintenance cost and track property's financial progress! Share your questions and thoughts in the AI driven forum.","Investing|Artificial Intelligence|Home services","2023-12-30T07:10:20Z","3","2","https://www.producthunt.com/r/KE2JDSLUK6KSAF?utm_campaign=producthunt-api&utm_medium=api-v2&utm_source=Application%3A+RL+search+%28ID%3A+290620%29","https://www.producthunt.com/products/homelens-x/launches/homelens-x?utm_campaign=producthunt-api&utm_medium=api-v2&utm_source=Application%3A+RL+search+%28ID%3A+290620%29"
"432067","Love Type Test ? AI Counseling","Discover your love type with our AI-driven app.","Based on Sternberg's Triangular Theory of Love, our app uses 60 questions to determine your type among 27 love styles. Get compatibility assessments, relationship advice, and personalized answers from ChatGPT for self-care in love.","Android|User Experience|Education|Artificial Intelligence","2023-12-30T05:17:20Z","1","1","https://www.producthunt.com/r/OEHOTEJPIOJXUN?utm_campaign=producthunt-api&utm_medium=api-v2&utm_source=Application%3A+RL+search+%28ID%3A+290620%29","https://www.producthunt.com/products/love-type-test-ai-counseling/launches/love-type-test-ai-counseling?utm_campaign=producthunt-api&utm_medium=api-v2&utm_source=Application%3A+RL+search+%28ID%3A+290620%29"
"432066","YandexGPT","Generative AI technology by Yandex","This versatile neural network excels in tasks such as text generation and analysis, responding to open-ended questions, ideation, slogan and scenario creation, and simplifying complex subjects.","Artificial Intelligence","2023-12-30T05:07:16Z","6","1","https://www.producthunt.com/r/IUQB6R5UF5XWU3?utm_campaign=producthunt-api&utm_medium=api-v2&utm_source=Application%3A+RL+search+%28ID%3A+290620%29","https://www.producthunt.com/products/yandex-gpt/launches/yandexgpt?utm_campaign=producthunt-api&utm_medium=api-v2&utm_source=Application%3A+RL+search+%28ID%3A+290620%29"
"432055","PowerChat","Powerful AI Assistant","PowerChat is a platform that lets people ask questions, get instant answers, and have back-and-forth conversations with a wide variety of AI-powered bots.","Robots|Artificial Intelligence","2023-12-30T01:26:18Z","2","1","https://www.producthunt.com/r/UARZYMP5AMZVLM?utm_campaign=producthunt-api&utm_medium=api-v2&utm_source=Application%3A+RL+search+%28ID%3A+290620%29","https://www.producthunt.com/products/powerchat/launches/powerchat-2?utm_campaign=producthunt-api&utm_medium=api-v2&utm_source=Application%3A+RL+search+%28ID%3A+290620%29"
"432046","CloudMate","Streamline Your Cloud - Efficiency Meets Innovation","CloudMate: Integrate and manage all your cloud services with ease. Enjoy a simplified, secure, and smart multi-cloud dashboard. DEMO: https://youtu.be/f4SYJUgXYmk","Analytics|Artificial Intelligence|Tech","2023-12-29T23:33:22Z","3","2","https://www.producthunt.com/r/FCBFKUD6L2RYSN?utm_campaign=producthunt-api&utm_medium=api-v2&utm_source=Application%3A+RL+search+%28ID%3A+290620%29","https://www.producthunt.com/products/cloudmate/launches/cloudmate?utm_campaign=producthunt-api&utm_medium=api-v2&utm_source=Application%3A+RL+search+%28ID%3A+290620%29"
"432044","Luna","Mental Health Insights for Your Teams","Luna is an AI-powered solution that helps businesses address mental health concerns in their teams. By integrating with digital workspaces, Luna gathers data to provide insights into team dynamics, stress levels, and mental health risks.","Health & Fitness|Artificial Intelligence|Remote Work","2023-12-29T23:29:35Z","1","1","https://www.producthunt.com/r/4HERIDV6DCV5AZ?utm_campaign=producthunt-api&utm_medium=api-v2&utm_source=Application%3A+RL+search+%28ID%3A+290620%29","https://www.producthunt.com/products/luna-8/launches/luna-91565d5e-7cdd-4f71-ab2a-a074c19a34d7?utm_campaign=producthunt-api&utm_medium=api-v2&utm_source=Application%3A+RL+search+%28ID%3A+290620%29"
"431985","GPTfy","Give your team the power of AI","AI for Salesforce Integration enhances Your Clouds Strategy. Connect your Sales cloud, Service Cloud, and Financial services cloud with our best AI tool.","SaaS|Artificial Intelligence|Tech","2023-12-29T12:47:38Z","0","0","https://www.producthunt.com/r/HKSXYYO4ZZJUPV?utm_campaign=producthunt-api&utm_medium=api-v2&utm_source=Application%3A+RL+search+%28ID%3A+290620%29","https://www.producthunt.com/products/gptfy/launches/gptfy?utm_campaign=producthunt-api&utm_medium=api-v2&utm_source=Application%3A+RL+search+%28ID%3A+290620%29"
"431971","Langify","Auto translate String Catalog files to 9 languages on Xcode","With Langify, you can easily translate your app into English, French, Ukrainian, Portuguese (Brasil), Japanese, German, Spanish, Russian and Italian. Langify offers a comprehensive translation solution, making it easy for you to expand the reach of your app.","Developer Tools|Artificial Intelligence|Tech","2023-12-29T12:01:00Z","2","1","https://www.producthunt.com/r/MO5HTG6RC2XIWN?utm_campaign=producthunt-api&utm_medium=api-v2&utm_source=Application%3A+RL+search+%28ID%3A+290620%29","https://www.producthunt.com/products/langify/launches/langify?utm_campaign=producthunt-api&utm_medium=api-v2&utm_source=Application%3A+RL+search+%28ID%3A+290620%29"
"431836","ExerDevAI","ExerDevAI is an AI-powered development exercise generator.","ExerDevAI is a tool for generating development exercises with AI. You can choose the amount of time we have in front of us, the difficulty of the exercise, the programming language and our level of web development.","Education|Artificial Intelligence|Tech","2023-12-29T10:01:00Z","15","2","https://www.producthunt.com/r/YCJ5EI4R5GZJIT?utm_campaign=producthunt-api&utm_medium=api-v2&utm_source=Application%3A+RL+search+%28ID%3A+290620%29","https://www.producthunt.com/products/exerdevai/launches/exerdevai?utm_campaign=producthunt-api&utm_medium=api-v2&utm_source=Application%3A+RL+search+%28ID%3A+290620%29"
"431955","LegenDraw","Let AI Craft Your D&D Character's Epic Portrait!","LegenDraw transforms your 5E characters into stunning AI-generated portraits. Just enter your DnDBeyond character profile link for a unique, artistic representation. Join our public beta now and add magic to your gaming!","Artificial Intelligence|Games","2023-12-29T09:01:00Z","8","3","https://www.producthunt.com/r/UKGJWMPITLL4Z7?utm_campaign=producthunt-api&utm_medium=api-v2&utm_source=Application%3A+RL+search+%28ID%3A+290620%29","https://www.producthunt.com/products/legendraw/launches/legendraw?utm_campaign=producthunt-api&utm_medium=api-v2&utm_source=Application%3A+RL+search+%28ID%3A+290620%29"
"431730","Aleah AI","The Only Artificial Intelligence Service you ever need","Are you tired of staring at a blank screen, struggling to find the right words for your blog, article, or marketing copy? Say goodbye to writer's block and hello to effortless content creation with our cutting-edge AI-powered content writer tool!","Android|Design Tools|Writing|Artificial Intelligence","2023-12-29T09:01:00Z","7","3","https://www.producthunt.com/r/DFZ2UQR7PMUFRP?utm_campaign=producthunt-api&utm_medium=api-v2&utm_source=Application%3A+RL+search+%28ID%3A+290620%29","https://www.producthunt.com/products/aleah-ai/launches/aleah-ai?utm_campaign=producthunt-api&utm_medium=api-v2&utm_source=Application%3A+RL+search+%28ID%3A+290620%29"
"431958","Bard AI for Zapier","Access Bard Gemini Pro AI ✨ for Zapier","Using Bard AI for Zapier, you can get responses for any prompt, summarize text, categorize items, and do more. With this text-based AI, you can ask for content up to April 2023, making it more knowledgeable than ChatGPT.","Artificial Intelligence|Search","2023-12-29T08:48:19Z","11","2","https://www.producthunt.com/r/PQMVTVLLMWKS54?utm_campaign=producthunt-api&utm_medium=api-v2&utm_source=Application%3A+RL+search+%28ID%3A+290620%29","https://www.producthunt.com/products/bard-ai-for-zapier/launches/bard-ai-for-zapier?utm_campaign=producthunt-api&utm_medium=api-v2&utm_source=Application%3A+RL+search+%28ID%3A+290620%29"
"431885","Behavly","Elevate your website with purposeful, targeted small tweaks","Behavly is your AI companion for better website decisions. Enter your URL and get actionable suggestions on content, design, and functionality. Overcome decision paralysis with purposeful tweaks tailored to your website.","Writing|A/B Testing|Artificial Intelligence","2023-12-29T08:19:55Z","179","62","https://www.producthunt.com/r/7YBUYLEZUQZ2RN?utm_campaign=producthunt-api&utm_medium=api-v2&utm_source=Application%3A+RL+search+%28ID%3A+290620%29","https://www.producthunt.com/products/behavly/launches/behavly?utm_campaign=producthunt-api&utm_medium=api-v2&utm_source=Application%3A+RL+search+%28ID%3A+290620%29"
"431927","Fridge2Food - Transform food into meals","Snap pics of food or liquor to generate instant recipe ideas","Transform your current fridge and pantry into a treasure trove of culinary delights with Fridge2Food – Your Ultimate Cooking Companion! Customize for cocktails or any dietary preference. Unlock new recipe ideas without having to go to the grocery store.","iOS|Cooking|Artificial Intelligence","2023-12-29T08:18:54Z","138","26","https://www.producthunt.com/r/I5ZAXRF26OVEAI?utm_campaign=producthunt-api&utm_medium=api-v2&utm_source=Application%3A+RL+search+%28ID%3A+290620%29","https://www.producthunt.com/products/fridge2food-transform-food-into-meals/launches/fridge2food-transform-food-into-meals?utm_campaign=producthunt-api&utm_medium=api-v2&utm_source=Application%3A+RL+search+%28ID%3A+290620%29"
"431915","Pawtrait Studio","Pets to People to Pets","Step into Pawtrait Studio's enchanting world! Our AI 'Switcheroo' transforms pets into people and vice versa. Turn your lab into a dapper gent, your cat into an elegant lady. Be a playful puppy or bouncy bunny! Have fun and join the whimsical journey now!","Pets|Photography|Artificial Intelligence","2023-12-29T08:14:53Z","129","24","https://www.producthunt.com/r/JYTX6UPJYDOHR7?utm_campaign=producthunt-api&utm_medium=api-v2&utm_source=Application%3A+RL+search+%28ID%3A+290620%29","https://www.producthunt.com/products/pawtrait-studio/launches/pawtrait-studio?utm_campaign=producthunt-api&utm_medium=api-v2&utm_source=Application%3A+RL+search+%28ID%3A+290620%29"
