"430570","AI Clips","Your AI co-pilot to turn long videos into viral shorts","AI Clips is a gen AI that transforms long videos into viral shorts in 1 click. Upload your podcasts, webinars or interviews and let the Simplified AI co-pilot curate highlights and create branded, captioned, bite-sized reels and shorts ready to share on social","Social Media|Artificial Intelligence|Video","2023-12-19T10:05:28Z","275","45","https://www.producthunt.com/r/TTUIJRKVZC33E3?utm_campaign=producthunt-api&utm_medium=api-v2&utm_source=Application%3A+RL+search+%28ID%3A+290620%29","https://www.producthunt.com/products/ai-clips/launches/ai-clips?utm_campaign=producthunt-api&utm_medium=api-v2&utm_source=Application%3A+RL+search+%28ID%3A+290620%29"
"430012","AI Contract Analysis","Affordable legal document navigation in 57 languages","Instantly access easy-to-understand contract analysis for just a few dollars. Stop blindly signing documents and start understanding the hidden impacts. Over 50 languages supported.","SaaS|Legal|Artificial Intelligence","2023-12-19T10:02:48Z","173","67","https://www.producthunt.com/r/KED76WPNTHE2NZ?utm_campaign=producthunt-api&utm_medium=api-v2&utm_source=Application%3A+RL+search+%28ID%3A+290620%29","https://www.producthunt.com/products/betterlegal-assistant/launches/ai-contract-analysis?utm_campaign=producthunt-api&utm_medium=api-v2&utm_source=Application%3A+RL+search+%28ID%3A+290620%29"
"430595","ChatAvatar.Me","10x your online presence without losing personal touch","🌐 Introducing ChatAvatar.Me, tailored for tech influencers, podcasters, e-commerce sellers, coaches, and online course educators. Our mission is to enhance your online influence, ensuring a consistent and authentic presence with a 24/7 digital you.","Productivity|Artificial Intelligence|Virtual Assistants","2023-12-19T09:12:31Z","35","14","https://www.producthunt.com/r/OBJBGHSLO7QOB5?utm_campaign=producthunt-api&utm_medium=api-v2&utm_source=Application%3A+RL+search+%28ID%3A+290620%29","https://www.producthunt.com/products/chatavatar-me/launches/chatavatar-me?utm_campaign=producthunt-api&utm_medium=api-v2&utm_source=Application%3A+RL+search+%28ID%3A+290620%29"
"430276","RightJoin AI Mock Interviews","Personalized mock interviews for job seekers","RightJoin helps professionals in the job market with personalized AI-powered mock interviews designed to test a diverse set of technical & behavioral skills. Users can also add their coaches/mentors to their ""Team"".","Artificial Intelligence|Online Learning|Career","2023-12-19T08:38:08Z","101","11","https://www.producthunt.com/r/4FYDTTVFUNCZS5?utm_campaign=producthunt-api&utm_medium=api-v2&utm_source=Application%3A+RL+search+%28ID%3A+290620%29","https://www.producthunt.com/products/rightjoin-ai-mock-interviews/launches/rightjoin-ai-mock-interviews?utm_campaign=producthunt-api&utm_medium=api-v2&utm_source=Application%3A+RL+search+%28ID%3A+290620%29"
"430061","MealByMeal","Easy AI powered calorie and macro tracking over text","MealByMeal is a subscription-based meal tracker that helps you count calories and macros over text messages. There's no app – just text what you eat and everything is logged for you. MealByMeal is the easiest way to track your food intake! Try it today!","Health & Fitness|Artificial Intelligence|Quantified Self","2023-12-19T08:33:25Z","282","77","https://www.producthunt.com/r/6WEFAZZGQK4MO5?utm_campaign=producthunt-api&utm_medium=api-v2&utm_source=Application%3A+RL+search+%28ID%3A+290620%29","https://www.producthunt.com/products/mealbymeal/launches/mealbymeal?utm_campaign=producthunt-api&utm_medium=api-v2&utm_source=Application%3A+RL+search+%28ID%3A+290620%29"
"430142","SciPub+","Revolutionize your academic writing","SciPub+ transforms academic writing with AI-powered assistants, simplifying every step from outlining to final proofreading. Streamline research papers, theses, and more with intuitive tools designed for efficiency and precision in scientific writing.","Productivity|Education|Artificial Intelligence","2023-12-19T08:32:27Z","101","20","https://www.producthunt.com/r/IL74FYHIQN5R22?utm_campaign=producthunt-api&utm_medium=api-v2&utm_source=Application%3A+RL+search+%28ID%3A+290620%29","https://www.producthunt.com/products/scipub/launches/scipub?utm_campaign=producthunt-api&utm_medium=api-v2&utm_source=Application%3A+RL+search+%28ID%3A+290620%29"
"430468","News Sentinel by Blockbrain","All crypto signals, no noise","The News Sentinel is empowering your investments with AI. Uncover hidden trading signals and risk insights from social data and take your portfolio to new heights of protection, optimization, and growth.","Investing|Crypto|Artificial Intelligence","2023-12-19T08:23:53Z","125","63","https://www.producthunt.com/r/J43IK3QQ4WOYMV?utm_campaign=producthunt-api&utm_medium=api-v2&utm_source=Application%3A+RL+search+%28ID%3A+290620%29","https://www.producthunt.com/products/news-sentinel-by-blockbrain/launches/news-sentinel-by-blockbrain?utm_campaign=producthunt-api&utm_medium=api-v2&utm_source=Application%3A+RL+search+%28ID%3A+290620%29"
"430587","Gali AI","Custom ChatGPT assistants connected to your backend","Create custom ChatGPT assistants connected to your backend and trained on your data. Gali AI assistants are chatbots on steroids that can be easily added to your website to generate more leads 🚀 and improve support 🙌 interacting with your backend.","Artificial Intelligence|Bots|No-Code","2023-12-19T08:01:36Z","8","17","https://www.producthunt.com/r/HJPLRGIBY2YCXE?utm_campaign=producthunt-api&utm_medium=api-v2&utm_source=Application%3A+RL+search+%28ID%3A+290620%29","https://www.producthunt.com/products/gali-ai/launches/gali-ai?utm_campaign=producthunt-api&utm_medium=api-v2&utm_source=Application%3A+RL+search+%28ID%3A+290620%29"
"430466","Askabook","Unlock book ideas with AI","Askabook is an app for readers with limited time. Read AI bite-sized book chapter summaries in just a few minutes. Search & find thousands of book summaries. You can also ask questions to the book itself and engage in a dynamic chat conversation.","Android|Productivity|Artificial Intelligence|Books","2023-12-19T08:01:00Z","3","1","https://www.producthunt.com/r/T2FHOUSS4R7YLZ?utm_campaign=producthunt-api&utm_medium=api-v2&utm_source=Application%3A+RL+search+%28ID%3A+290620%29","https://www.producthunt.com/products/askabook/launches/askabook?utm_campaign=producthunt-api&utm_medium=api-v2&utm_source=Application%3A+RL+search+%28ID%3A+290620%29"
"430550","Korus","Deadmau5-founded AI-powered music creation platform","Korus — AI-powered music companions that give you the power to play, create and remix music from iconic labels and more in a fun, first-of-its-kind interactive format.","Music|Artificial Intelligence|Electronic Music","2023-12-19T08:01:00Z","175","20","https://www.producthunt.com/r/ZNKJKVRCCHB3DY?utm_campaign=producthunt-api&utm_medium=api-v2&utm_source=Application%3A+RL+search+%28ID%3A+290620%29","https://www.producthunt.com/products/korus/launches/korus?utm_campaign=producthunt-api&utm_medium=api-v2&utm_source=Application%3A+RL+search+%28ID%3A+290620%29"
"430561","MyMap Visual Story","Create Beautiful Visual Presentation using AI","Bring your ideas to life with stunning visuals using MyMap's free Visual Story tool. Perfect for knowledge workers, content creators, and students seeking impactful presentations","Productivity|Education|Artificial Intelligence","2023-12-19T08:01:00Z","51","26","https://www.producthunt.com/r/UTHFHBLZ2EDUUC?utm_campaign=producthunt-api&utm_medium=api-v2&utm_source=Application%3A+RL+search+%28ID%3A+290620%29","https://www.producthunt.com/products/mymap/launches/mymap-visual-story?utm_campaign=producthunt-api&utm_medium=api-v2&utm_source=Application%3A+RL+search+%28ID%3A+290620%29"
"430534","GPT Login","Authentication layer for GPT","An authentication layer for your own GPT. Gate the access of your GPT with a no-signup, passwordless system. Now, you can monetize the GPT you put time, effort and data in.","API|Artificial Intelligence","2023-12-19T08:01:00Z","1","0","https://www.producthunt.com/r/EFKYXVCKEYX35C?utm_campaign=producthunt-api&utm_medium=api-v2&utm_source=Application%3A+RL+search+%28ID%3A+290620%29","https://www.producthunt.com/products/gpt-login/launches/gpt-login?utm_campaign=producthunt-api&utm_medium=api-v2&utm_source=Application%3A+RL+search+%28ID%3A+290620%29"
"430552","SEC GPT","Start talking to SEC filings!","Introducing SEC GPT! Start talking to official documents with ease and make better decisions. SEC GPT can.. 1. Find information faster and easier. 2. Summarize filed documents. 3. Understand documents in much easier words. 4. Interpret any language.","Productivity|Investing|Artificial Intelligence","2023-12-19T08:01:00Z","2","2","https://www.producthunt.com/r/7RAS2ZXKHOIWKS?utm_campaign=producthunt-api&utm_medium=api-v2&utm_source=Application%3A+RL+search+%28ID%3A+290620%29","https://www.producthunt.com/products/sec-gpt/launches/sec-gpt?utm_campaign=producthunt-api&utm_medium=api-v2&utm_source=Application%3A+RL+search+%28ID%3A+290620%29"
"421409","Autonoma","Confluence like code documentation automatically with AI","From any codebase, we generate a wiki with API Docs, descriptions of features and their implementation, and common guides maintaining the original style, language, and dependencies. These enables developers to understand legacy, spaghetti, or throwaway code.","Software Engineering|Developer Tools|Artificial Intelligence","2023-12-19T08:01:00Z","172","42","https://www.producthunt.com/r/MUANR2T4GJFCW3?utm_campaign=producthunt-api&utm_medium=api-v2&utm_source=Application%3A+RL+search+%28ID%3A+290620%29","https://www.producthunt.com/products/autonoma/launches/autonoma?utm_campaign=producthunt-api&utm_medium=api-v2&utm_source=Application%3A+RL+search+%28ID%3A+290620%29"
"430517","Seamless","AI for literature review","🚀 Explore AI-Driven Research with Seamless: Your AI Literature Companion! 📚 🌟 Features: 🧠 Finds relevant, up-to-date papers 📃 Synthesizes findings from multiple sources. 🔧 Customizable searches","Artificial Intelligence|Science","2023-12-19T08:01:00Z","1","1","https://www.producthunt.com/r/ZPJWCL6BCJOI6W?utm_campaign=producthunt-api&utm_medium=api-v2&utm_source=Application%3A+RL+search+%28ID%3A+290620%29","https://www.producthunt.com/products/seamless-4/launches/seamless-4?utm_campaign=producthunt-api&utm_medium=api-v2&utm_source=Application%3A+RL+search+%28ID%3A+290620%29"
"430322","vAI - Don’t Buy Ads - Use This Instead","Legally Hijack ANY Video & Turn It Into Profits Instantly","World’s First Google AI Bard-Powered App That Legally Hijacks Any Video Online And Redirect All Its Views To Any Link We Want Instantly… Making Us $695.34 Daily On Autopilot…","Artificial Intelligence|Product Hunt|Money","2023-12-19T08:01:00Z","1","0","https://www.producthunt.com/r/FCY2QETJD434KU?utm_campaign=producthunt-api&utm_medium=api-v2&utm_source=Application%3A+RL+search+%28ID%3A+290620%29","https://www.producthunt.com/products/vai-don-t-buy-ads-use-this-instead/launches/vai-don-t-buy-ads-use-this-instead?utm_campaign=producthunt-api&utm_medium=api-v2&utm_source=Application%3A+RL+search+%28ID%3A+290620%29"
"429373","Creatify AI","Create short video ads in seconds, just with a product URL","Creatify AI generates highly engaging & professional quality marketing video for any product just from a single product link. Instead of expensive & unreliable agencies, just have AI to analyze product details, gather design assets, and create videos for you.","Social Media|Advertising|Artificial Intelligence","2023-12-19T08:01:00Z","595","261","https://www.producthunt.com/r/ZVU2IOP2SXAAKQ?utm_campaign=producthunt-api&utm_medium=api-v2&utm_source=Application%3A+RL+search+%28ID%3A+290620%29","https://www.producthunt.com/products/creatify/launches/creatify-ai?utm_campaign=producthunt-api&utm_medium=api-v2&utm_source=Application%3A+RL+search+%28ID%3A+290620%29"
"429506","Simpla AI","Smooth business finances with Simpla's AI powered solution","Simpla is your all-in-one financial tool - a perfect blend of cutting-edge AI & a user-friendly interface. We’re here to help startups & SMEs improve efficiency by deep-diving into their business finances and assisting them in making smart business decisions.","SaaS|Artificial Intelligence|Finance","2023-12-19T08:01:00Z","80","56","https://www.producthunt.com/r/W6ILZJHWDCYSIY?utm_campaign=producthunt-api&utm_medium=api-v2&utm_source=Application%3A+RL+search+%28ID%3A+290620%29","https://www.producthunt.com/products/simpla-ai/launches/simpla-ai?utm_campaign=producthunt-api&utm_medium=api-v2&utm_source=Application%3A+RL+search+%28ID%3A+290620%29"
"430580","Web to WordPress AI","Let AI transform any website into a WordPress theme","Meet Web to WordPress AI: Let AI transform any website into a stunning WordPress theme in a few clicks—no coding required! Download your theme, customize it effortlessly on WordPress and launch on your server or ours directly. WordPress magic, simplified!","Design Tools|WordPress|Website Builder|Artificial Intelligence|No-Code","2023-12-19T08:01:00Z","11","12","https://www.producthunt.com/r/UROBK3V4XWSOK2?utm_campaign=producthunt-api&utm_medium=api-v2&utm_source=Application%3A+RL+search+%28ID%3A+290620%29","https://www.producthunt.com/products/yotako/launches/web-to-wordpress-ai?utm_campaign=producthunt-api&utm_medium=api-v2&utm_source=Application%3A+RL+search+%28ID%3A+290620%29"
"430489","Writetone: AI Writing Assistant","Chrome extension to paraphrase, generate reply, & make post","Writetone is a Chrome extension that helps you write clear, concise, and effective text, as well as a grammar checker and summarizer. You can also use Writetone to reply to social media messages in the desired tone.","Writing|Social Media|Artificial Intelligence","2023-12-19T08:01:00Z","6","0","https://www.producthunt.com/r/5MO6NRSBAXJVAA?utm_campaign=producthunt-api&utm_medium=api-v2&utm_source=Application%3A+RL+search+%28ID%3A+290620%29","https://www.producthunt.com/products/writetone-ai-writing-assistant/launches/writetone-ai-writing-assistant?utm_campaign=producthunt-api&utm_medium=api-v2&utm_source=Application%3A+RL+search+%28ID%3A+290620%29"
"430372","novita.ai Remove Background","Remove image background online 100% automatically & fast","novita.ai provides ""Remove Background"" API and playground demo. 100% automatically remove backgrounds from your images in 5 seconds with just one click. Say goodbye to tedious hours spent meticulously selecting pixels manually. Simply upload your image now!","API|Developer Tools|Artificial Intelligence","2023-12-19T08:00:00Z","6","2","https://www.producthunt.com/r/H45H3OXVDXJMNO?utm_campaign=producthunt-api&utm_medium=api-v2&utm_source=Application%3A+RL+search+%28ID%3A+290620%29","https://www.producthunt.com/products/novita-ai/launches/novita-ai-remove-background?utm_campaign=producthunt-api&utm_medium=api-v2&utm_source=Application%3A+RL+search+%28ID%3A+290620%29"
"430578","SecurePipeline-platform for tech experts","Monetize your audience and influence more","you can maximize your compiling and launch potential while maintaining the integrity of your users' personal data.","Productivity|Artificial Intelligence|Tech","2023-12-19T07:35:00Z","1","1","https://www.producthunt.com/r/S6LU5J6CHF6QLA?utm_campaign=producthunt-api&utm_medium=api-v2&utm_source=Application%3A+RL+search+%28ID%3A+290620%29","https://www.producthunt.com/products/securepipeline-platform-for-tech-experts/launches/securepipeline-platform-for-tech-experts?utm_campaign=producthunt-api&utm_medium=api-v2&utm_source=Application%3A+RL+search+%28ID%3A+290620%29"
"430411","Kiru.ai","Transform your hiring game with Kiru.ai","Use AI to screen and shortlist candidates.","Hiring|Artificial Intelligence|Tech","2023-12-19T07:01:00Z","3","2","https://www.producthunt.com/r/PPUBHMJ7XRHTPO?utm_campaign=producthunt-api&utm_medium=api-v2&utm_source=Application%3A+RL+search+%28ID%3A+290620%29","https://www.producthunt.com/products/kiru-ai/launches/kiru-ai?utm_campaign=producthunt-api&utm_medium=api-v2&utm_source=Application%3A+RL+search+%28ID%3A+290620%29"
"430566","Arcs Work","A.l. based crypto financing application","Arcs work is a web application predominantly focusing on the aspects of decentralized internet. It aims to provide financial solutions in a reliable, trustworthy, secured manner. At its core relies the ideology of user anonymity and internet freedom.","Artificial Intelligence|Web3|Blockchain","2023-12-19T06:22:26Z","1","0","https://www.producthunt.com/r/W6E6VPIQ2LTCIF?utm_campaign=producthunt-api&utm_medium=api-v2&utm_source=Application%3A+RL+search+%28ID%3A+290620%29","https://www.producthunt.com/products/arcs-work/launches/arcs-work?utm_campaign=producthunt-api&utm_medium=api-v2&utm_source=Application%3A+RL+search+%28ID%3A+290620%29"
"430562","Booqs","AI Turn Any URL, Website, Blog To “eBooks & Flipbooks”","Imagine if you let a powerful AI app, write, & design eBooks for you in any niche. Here, how it works ✅ Login to Booqs. ✅ Enter One Keyword & Instantly Generate a Fully Designed eBook ✅ Let AI Syndicate Your eBook Across Millions Of Buyers In Any Niche.","eBook Reader|Design Tools|Artificial Intelligence","2023-12-19T06:14:26Z","1","0","https://www.producthunt.com/r/JPY5T5CMKF5HQD?utm_campaign=producthunt-api&utm_medium=api-v2&utm_source=Application%3A+RL+search+%28ID%3A+290620%29","https://www.producthunt.com/products/booqs/launches/booqs?utm_campaign=producthunt-api&utm_medium=api-v2&utm_source=Application%3A+RL+search+%28ID%3A+290620%29"
"430531","LowerEBill","AI-driven energy savings and efficient plan recommendations","LowerEBill leverages advanced AI technology to optimize energy consumption for consumers. By analyzing usage patterns and market rates, it offers personalized recommendations for energy plans, ensuring cost-effectiveness and efficiency.","Artificial Intelligence|Climate Tech","2023-12-18T21:35:44Z","2","1","https://www.producthunt.com/r/IXHUZCOK5AUQTJ?utm_campaign=producthunt-api&utm_medium=api-v2&utm_source=Application%3A+RL+search+%28ID%3A+290620%29","https://www.producthunt.com/products/lowerebill/launches/lowerebill?utm_campaign=producthunt-api&utm_medium=api-v2&utm_source=Application%3A+RL+search+%28ID%3A+290620%29"
"430482","SumsItUp!","Free summaries of links & text - you choose format and style","SumsItUp! Your Free AI Summarizer. Customized summaries of links, text or even broad concepts in your choice of format, language and style. Read, Listen, Share - Learn!","Productivity|Artificial Intelligence","2023-12-18T15:39:43Z","0","1","https://www.producthunt.com/r/INVA7655ZYWEX2?utm_campaign=producthunt-api&utm_medium=api-v2&utm_source=Application%3A+RL+search+%28ID%3A+290620%29","https://www.producthunt.com/products/sumsitup/launches/sumsitup?utm_campaign=producthunt-api&utm_medium=api-v2&utm_source=Application%3A+RL+search+%28ID%3A+290620%29"
"430349","PONS.ai","Send your friends/clients a next-gen AI Xmas card","PONS.ai lets you co-create with famous AI artists and send the world’s most innovative AI greeting card with next-gen features to better delight your friends/clients. Our mission is to create a more meaningful world for humanity—with technology and creativity.","Customer Communication|Artificial Intelligence|Digital Art","2023-12-18T15:02:58Z","209","85","https://www.producthunt.com/r/CJTDRF2KFCKEVV?utm_campaign=producthunt-api&utm_medium=api-v2&utm_source=Application%3A+RL+search+%28ID%3A+290620%29","https://www.producthunt.com/products/pons-ai/launches/pons-ai?utm_campaign=producthunt-api&utm_medium=api-v2&utm_source=Application%3A+RL+search+%28ID%3A+290620%29"
"430459","SurferPips AI","Advanced bot for consistent trading income","SurferPips, an advanced trading bot ensuring consistent income. Adaptable to all forex pairs, easily optimize and deploy for seamless trading.","Investing|Artificial Intelligence|Money","2023-12-18T12:30:16Z","1","1","https://www.producthunt.com/r/3B2TUQKFJWOKFX?utm_campaign=producthunt-api&utm_medium=api-v2&utm_source=Application%3A+RL+search+%28ID%3A+290620%29","https://www.producthunt.com/products/surferpips-ai/launches/surferpips-ai?utm_campaign=producthunt-api&utm_medium=api-v2&utm_source=Application%3A+RL+search+%28ID%3A+290620%29"
"428224","IXORD Notes AI","Smart app for smart lists & notes","Dive into organization and productivity with IXORD Notes AI – your personal organizer and task management assistant. More than a simple notes app, it's the central hub for your daily life, equipped with special features to streamline your affairs. 🚀","Android|Productivity|Artificial Intelligence|Tech","2023-12-18T12:04:09Z","115","21","https://www.producthunt.com/r/QNTWIVJDLCK4KG?utm_campaign=producthunt-api&utm_medium=api-v2&utm_source=Application%3A+RL+search+%28ID%3A+290620%29","https://www.producthunt.com/products/ixord/launches/ixord-notes-ai?utm_campaign=producthunt-api&utm_medium=api-v2&utm_source=Application%3A+RL+search+%28ID%3A+290620%29"
"430404","ChatGpt Content Detector","AI sleuth: fun tool for spotting AI written text","Check if what you're reading was generated by AI! Paste it here to find out.","Artificial Intelligence","2023-12-18T10:07:01Z","6","0","https://www.producthunt.com/r/HDZCWSHZZEK5LV?utm_campaign=producthunt-api&utm_medium=api-v2&utm_source=Application%3A+RL+search+%28ID%3A+290620%29","https://www.producthunt.com/products/chatgpt-content-detector/launches/chatgpt-content-detector?utm_campaign=producthunt-api&utm_medium=api-v2&utm_source=Application%3A+RL+search+%28ID%3A+290620%29"
"430395","Ho Ho Hello!","Get a magical personalized video from Santa","Get a personalized video from Santa Claus and bring some Christmas magic to the kids in your life! All generated by AI.","Artificial Intelligence|Pop culture|Video","2023-12-18T09:53:02Z","1","1","https://www.producthunt.com/r/NVL5MLQRX577IO?utm_campaign=producthunt-api&utm_medium=api-v2&utm_source=Application%3A+RL+search+%28ID%3A+290620%29","https://www.producthunt.com/products/ho-ho-hello/launches/ho-ho-hello?utm_campaign=producthunt-api&utm_medium=api-v2&utm_source=Application%3A+RL+search+%28ID%3A+290620%29"
"430158","CopyNinja - AI Copywriter for Shopify","Shopify app that creates SEO optimized product descriptions","Shopify merchants can now create SEO optimized product descriptions in bulk with a few clicks! Also create blog posts, translations and more.","SEO|Artificial Intelligence|E-Commerce","2023-12-18T09:36:23Z","245","39","https://www.producthunt.com/r/BFJLKIRUQM5C2S?utm_campaign=producthunt-api&utm_medium=api-v2&utm_source=Application%3A+RL+search+%28ID%3A+290620%29","https://www.producthunt.com/products/copyninja-ai-copywriter-for-shopify/launches/copyninja-ai-copywriter-for-shopify?utm_campaign=producthunt-api&utm_medium=api-v2&utm_source=Application%3A+RL+search+%28ID%3A+290620%29"
"430312","Pixplain by Merlin AI","Convert screenshots into insights by one-click GPT-4 vision","Pixplain is an AI-powered browser extension that help you easily capture screen areas, get GPT-4 Vision for analysis, and interact with visual content like never before. Experience enhanced clarity on any webpage with just a few clicks.","Chrome Extensions|Productivity|Artificial Intelligence","2023-12-18T09:34:58Z","216","54","https://www.producthunt.com/r/KG5JPTMKNBEDA2?utm_campaign=producthunt-api&utm_medium=api-v2&utm_source=Application%3A+RL+search+%28ID%3A+290620%29","https://www.producthunt.com/products/pixplain-by-merlin-ai/launches/pixplain-by-merlin-ai?utm_campaign=producthunt-api&utm_medium=api-v2&utm_source=Application%3A+RL+search+%28ID%3A+290620%29"
"430379","Prompt Dress","Helps you store, manage and use your AI prompts","Streamline AI interactions with 👗 Prompt Dress, a browser extension for efficient prompt management. Features an intuitive UI, dynamic prompt support, one-click insertion, sequence priming and easy organization. 100% free and compliant.","Chrome Extensions|Productivity|Artificial Intelligence|Tech","2023-12-18T09:22:26Z","4","0","https://www.producthunt.com/r/E55JDZXN67OBUH?utm_campaign=producthunt-api&utm_medium=api-v2&utm_source=Application%3A+RL+search+%28ID%3A+290620%29","https://www.producthunt.com/products/prompt-dress/launches/prompt-dress?utm_campaign=producthunt-api&utm_medium=api-v2&utm_source=Application%3A+RL+search+%28ID%3A+290620%29"
"430291","Neexa AI","The AI powered sales agent","Neexa is an AI-powered sales assistant that engages with prospects and customers on your website to drive automated sales, 24/7 🚀 WhatsApp integration available, Shopify integration in beta.","Productivity|Sales|Artificial Intelligence","2023-12-18T08:43:51Z","109","31","https://www.producthunt.com/r/EGYPTJJXHFQFRR?utm_campaign=producthunt-api&utm_medium=api-v2&utm_source=Application%3A+RL+search+%28ID%3A+290620%29","https://www.producthunt.com/products/neexa-ai/launches/neexa-ai?utm_campaign=producthunt-api&utm_medium=api-v2&utm_source=Application%3A+RL+search+%28ID%3A+290620%29"
"430370","AI Santa","Personalized phone calls with Santa, powered by AI","Call us for a special live chat with Santa, crafted for your child, and powered by AI.","Artificial Intelligence|Bots|Kids & Parenting","2023-12-18T08:34:29Z","53","4","https://www.producthunt.com/r/WKXDEWGJRRHTBI?utm_campaign=producthunt-api&utm_medium=api-v2&utm_source=Application%3A+RL+search+%28ID%3A+290620%29","https://www.producthunt.com/products/ai-santa/launches/ai-santa?utm_campaign=producthunt-api&utm_medium=api-v2&utm_source=Application%3A+RL+search+%28ID%3A+290620%29"
