"427442","Docu","Never sign a sketchy contract again, AI contract review","AI-Powered Contract Review. Turn legal jargon to valuable insights. Transform complex documents into clear insights. Improve your negotiating position and shield yourself from any possible risks.","Legal|Artificial Intelligence","2023-11-29T08:01:00Z","167","27","https://www.producthunt.com/r/SK4LFTE6BVIGZO?utm_campaign=producthunt-api&utm_medium=api-v2&utm_source=Application%3A+RL+search+%28ID%3A+290620%29","https://www.producthunt.com/products/docu/launches/docu?utm_campaign=producthunt-api&utm_medium=api-v2&utm_source=Application%3A+RL+search+%28ID%3A+290620%29"
"427239","Manot","Get insights into your computer vision model’s blind spots","An insight management platform for computer vision model performance. Manot pinpoints where, how, and why computer vision models fail. It accelerates model refinement and redeployment processes by 10x, boosts accuracy by 20%, and reduces costs by 32%.","SaaS|Artificial Intelligence|Data & Analytics","2023-11-29T08:01:00Z","236","151","https://www.producthunt.com/r/BHYV4FOAFY6LAC?utm_campaign=producthunt-api&utm_medium=api-v2&utm_source=Application%3A+RL+search+%28ID%3A+290620%29","https://www.producthunt.com/products/manot-2/launches/manot-2?utm_campaign=producthunt-api&utm_medium=api-v2&utm_source=Application%3A+RL+search+%28ID%3A+290620%29"
"425555","Morph 1.0","AI-powered BI dashboard across your SaaS data","Turn fragmented data across spreadsheets, SaaS platforms, and other data tools into clear insights and visual aids. AI-powered so you don’t have to write a single line of code. Make data your everyday tool.","Artificial Intelligence|Data & Analytics|Business Intelligence","2023-11-29T08:01:00Z","316","103","https://www.producthunt.com/r/4AXIWZ3PU5DJWG?utm_campaign=producthunt-api&utm_medium=api-v2&utm_source=Application%3A+RL+search+%28ID%3A+290620%29","https://www.producthunt.com/products/morphdb/launches/morph-1-0?utm_campaign=producthunt-api&utm_medium=api-v2&utm_source=Application%3A+RL+search+%28ID%3A+290620%29"
"426733","Techolution","Build the fastest-growing brand","One of the most admired brands in the world for ""innovation done right""","Artificial Intelligence|Tech|Consulting","2023-11-29T08:01:00Z","1","1","https://www.producthunt.com/r/WBT6UYDNL6Y43J?utm_campaign=producthunt-api&utm_medium=api-v2&utm_source=Application%3A+RL+search+%28ID%3A+290620%29","https://www.producthunt.com/products/techolution/launches/techolution?utm_campaign=producthunt-api&utm_medium=api-v2&utm_source=Application%3A+RL+search+%28ID%3A+290620%29"
"427166","Keyframes Studio","Create videos for socials","With TikTok, Reels, Shorts undeniably on the rise it is more important than ever to have a presence on social media. Keyframes Studio is an all-in-one platform for creating videos for all social media platforms. Now with the help of AI!","Social Media|Artificial Intelligence|Video","2023-11-29T08:01:00Z","1","1","https://www.producthunt.com/r/FBNSU7DUB5RGJV?utm_campaign=producthunt-api&utm_medium=api-v2&utm_source=Application%3A+RL+search+%28ID%3A+290620%29","https://www.producthunt.com/products/keyframes-studio/launches/keyframes-studio-3?utm_campaign=producthunt-api&utm_medium=api-v2&utm_source=Application%3A+RL+search+%28ID%3A+290620%29"
"426926","Launch Teddy","Your Personal AI Assistant for Successful Product Launches","Launch Teddy, your AI companion, offers tailored, adaptive strategies for successful product launches. Easy to use, it learns and evolves with each campaign, ensuring your launch resonates perfectly with your target audience.","Productivity|Marketing|Artificial Intelligence","2023-11-29T08:01:00Z","5","3","https://www.producthunt.com/r/NIE36W2ETE6S6M?utm_campaign=producthunt-api&utm_medium=api-v2&utm_source=Application%3A+RL+search+%28ID%3A+290620%29","https://www.producthunt.com/products/launch-teddy/launches/launch-teddy?utm_campaign=producthunt-api&utm_medium=api-v2&utm_source=Application%3A+RL+search+%28ID%3A+290620%29"
"427395","neoSVG","AI-based tool that generates SVG vectors from text prompts","Generate Scalable Vector Graphics using neoSVG's cutting-edge AI. With a clean and user-friendly interface, simply type your request, await the AI's response, and receive beautiful illustrations that look like they were made by experienced designers.","Artificial Intelligence|Digital Art|Illustration","2023-11-29T08:01:00Z","149","18","https://www.producthunt.com/r/LBMKFAKEYKMNIM?utm_campaign=producthunt-api&utm_medium=api-v2&utm_source=Application%3A+RL+search+%28ID%3A+290620%29","https://www.producthunt.com/products/neosvg/launches/neosvg?utm_campaign=producthunt-api&utm_medium=api-v2&utm_source=Application%3A+RL+search+%28ID%3A+290620%29"
"427428","EstimateAI","Estimate tasks using the power of artificial intelligence.","Estimate your tasks using the power of Artificial Intelligence and have more time to dedicate to create the product. Whether it's software development, marketing, or project management, the app can be tailored to suit the needs of various industries.","Task Management|SaaS|Artificial Intelligence","2023-11-29T08:01:00Z","106","28","https://www.producthunt.com/r/PFCNVHU6QFZZU5?utm_campaign=producthunt-api&utm_medium=api-v2&utm_source=Application%3A+RL+search+%28ID%3A+290620%29","https://www.producthunt.com/products/estimateai/launches/estimateai?utm_campaign=producthunt-api&utm_medium=api-v2&utm_source=Application%3A+RL+search+%28ID%3A+290620%29"
"427236","Cool GPTs","Manually curated catalog of useful GPTs.","OpenAI recently announced a new feature: custom GPTs. CoolGPTs is a catalog of best GPTs on the platform.","Artificial Intelligence|Bots","2023-11-29T08:01:00Z","5","3","https://www.producthunt.com/r/KLOICOY625FXYD?utm_campaign=producthunt-api&utm_medium=api-v2&utm_source=Application%3A+RL+search+%28ID%3A+290620%29","https://www.producthunt.com/products/cool-gpts/launches/cool-gpts?utm_campaign=producthunt-api&utm_medium=api-v2&utm_source=Application%3A+RL+search+%28ID%3A+290620%29"
"427366","novita.ai Image-to-video","AI Convert Image to Video Online & Easy to use for free!","novita.ai provides AI Image to Video Converter! Generate stunning videos from still images, with customizable frame rates of up to 14 or 25 frames. Experience the seamless transformation as your images come alive in dynamic motion. Try it now !","API|Developer Tools|Artificial Intelligence","2023-11-29T08:00:00Z","9","7","https://www.producthunt.com/r/PZ5WKYN27KKT5T?utm_campaign=producthunt-api&utm_medium=api-v2&utm_source=Application%3A+RL+search+%28ID%3A+290620%29","https://www.producthunt.com/products/novita-ai/launches/novita-ai-image-to-video?utm_campaign=producthunt-api&utm_medium=api-v2&utm_source=Application%3A+RL+search+%28ID%3A+290620%29"
"427476","BabyNamesPedia AI","Effortless discoveries with BabyNamesPedia's AI chatbot","BabyNamesPedia AI is a chatbot that eases the process of finding baby names by understanding user preferences and suggesting suitable options. Using advanced AI, it offers an interactive and personalized experience, making the search efficient and enjoyable.","Parenting|Artificial Intelligence|Tech","2023-11-29T05:37:37Z","1","1","https://www.producthunt.com/r/XCXGT5IKS2NQF5?utm_campaign=producthunt-api&utm_medium=api-v2&utm_source=Application%3A+RL+search+%28ID%3A+290620%29","https://www.producthunt.com/products/babynamespedia-ai-2/launches/babynamespedia-ai-2?utm_campaign=producthunt-api&utm_medium=api-v2&utm_source=Application%3A+RL+search+%28ID%3A+290620%29"
"427348","Write better with AI Writing Tool","Grammar Check, Spelling and Translate","Introducing ""Write Best with AI Grammar & Tools""! Unleash the power of AI for flawless grammar, voice recording, and seamless translation with voice and camera support in over 20 languages.","Android|Productivity|Marketing|Artificial Intelligence","2023-11-29T01:29:46Z","68","3","https://www.producthunt.com/r/MSTTQA4P27MLMJ?utm_campaign=producthunt-api&utm_medium=api-v2&utm_source=Application%3A+RL+search+%28ID%3A+290620%29","https://www.producthunt.com/products/write-best-with-ai-write-tools/launches/write-better-with-ai-writing-tool?utm_campaign=producthunt-api&utm_medium=api-v2&utm_source=Application%3A+RL+search+%28ID%3A+290620%29"
"427453","Next-Generation Text Classification","Categorize, analyze sentiment, or assign any tags to text","Categorize, assign tags, or analyze the sentiment of any text, up to 150k tokens. Comprehend-it is a next-generation text classification model designed for zero-shot, multi-label categorization with output scoring. Test in our AI Playground, no registration.","API|Artificial Intelligence|Data & Analytics","2023-11-28T22:50:38Z","6","3","https://www.producthunt.com/r/ALTELQLXMY76IY?utm_campaign=producthunt-api&utm_medium=api-v2&utm_source=Application%3A+RL+search+%28ID%3A+290620%29","https://www.producthunt.com/products/comprehend-it/launches/next-generation-text-classification?utm_campaign=producthunt-api&utm_medium=api-v2&utm_source=Application%3A+RL+search+%28ID%3A+290620%29"
"427446","Hearoo","AI audio story generator, because the best story is your own","""Hearoo"" is an AI-powered app, crafting personalized audio stories for your unique listening experience. Immerse in creative storytelling catered to your preferences on the go.","Artificial Intelligence|Audio|Kids & Parenting","2023-11-28T21:43:16Z","1","2","https://www.producthunt.com/r/OYE46GIVAABNMU?utm_campaign=producthunt-api&utm_medium=api-v2&utm_source=Application%3A+RL+search+%28ID%3A+290620%29","https://www.producthunt.com/products/hearoo/launches/hearoo?utm_campaign=producthunt-api&utm_medium=api-v2&utm_source=Application%3A+RL+search+%28ID%3A+290620%29"
"427286","Meeting Navigator","Organize your meetings and get more done with AI","Meeting Navigator is a simple tool looking to improve your meeting culture. It's designed to work with your objectives, analyze the potential costs and benefits of your meetings, and help you decide if they're necessary.","Productivity|Meetings|Artificial Intelligence","2023-11-28T20:28:46Z","72","6","https://www.producthunt.com/r/GO3Q5XCANO7VFX?utm_campaign=producthunt-api&utm_medium=api-v2&utm_source=Application%3A+RL+search+%28ID%3A+290620%29","https://www.producthunt.com/products/meeting-navigator/launches/meeting-navigator?utm_campaign=producthunt-api&utm_medium=api-v2&utm_source=Application%3A+RL+search+%28ID%3A+290620%29"
"427434","Trend Hunter GPT","Trend Report & Product Generator","A groundbreaking AI model poised to redefine the landscape of trend analysis & innovation. Trained to identify and suggest ideas for new products or services based on identified trends and forecasted consumer needs. Hunt hidden opportunities like never before","Marketing|Artificial Intelligence|Tech","2023-11-28T19:43:03Z","3","2","https://www.producthunt.com/r/J2PKXX34H3722W?utm_campaign=producthunt-api&utm_medium=api-v2&utm_source=Application%3A+RL+search+%28ID%3A+290620%29","https://www.producthunt.com/products/trend-hunter-ai-powered-trend-research/launches/trend-hunter-gpt?utm_campaign=producthunt-api&utm_medium=api-v2&utm_source=Application%3A+RL+search+%28ID%3A+290620%29"
"427411","BeGenieUs","Simplified Collaboration","Your innovative collaboration hub: Chat Circles - AI team collab. Doc Studio - AI docs creation and sharing. Video Library - Record videos and sharing hub. Landing Pages - AI no-code web design.","Productivity|Website Builder|Artificial Intelligence|No-Code|Chat rooms","2023-11-28T16:41:30Z","5","4","https://www.producthunt.com/r/GRCOH4ANNZV4R2?utm_campaign=producthunt-api&utm_medium=api-v2&utm_source=Application%3A+RL+search+%28ID%3A+290620%29","https://www.producthunt.com/products/begenieus/launches/begenieus?utm_campaign=producthunt-api&utm_medium=api-v2&utm_source=Application%3A+RL+search+%28ID%3A+290620%29"
"427408","Devsort","HARNESS THE POWER OF DATA","Elevating Business Success through Custom Web Application Development: In today's digitally-driven landscape, businesses thrive on their online presence and efficiency. The realm of web application development stands as a pivotal force","Developer Tools|Artificial Intelligence","2023-11-28T16:29:46Z","2","2","https://www.producthunt.com/r/646ICS2KN2BC5W?utm_campaign=producthunt-api&utm_medium=api-v2&utm_source=Application%3A+RL+search+%28ID%3A+290620%29","https://www.producthunt.com/products/devsort/launches/devsort?utm_campaign=producthunt-api&utm_medium=api-v2&utm_source=Application%3A+RL+search+%28ID%3A+290620%29"
"427407","Imgi.in","The Premium AI Image Generator","Imgi.in, introduces a premium yet affordable online AI image generation experience. Dive into the world of limitless creativity, where cutting-edge technology harmoniously blends with human ingenuity.","Art Books|Artificial Intelligence|Digital Art","2023-11-28T16:16:08Z","2","3","https://www.producthunt.com/r/CYU5L6D5NNJSDO?utm_campaign=producthunt-api&utm_medium=api-v2&utm_source=Application%3A+RL+search+%28ID%3A+290620%29","https://www.producthunt.com/products/imgi-in/launches/imgi-in?utm_campaign=producthunt-api&utm_medium=api-v2&utm_source=Application%3A+RL+search+%28ID%3A+290620%29"
"426317","008","Event-driven AI powered Open Source Softphone","Enhance your calls with our softphone. Its AI transcribes, summarizes, and extracts KPIs from your calls. It transfers call data to your preferred CRMs and tools, either via webhooks or our existing integrations with platforms like Zendesk and more!","Productivity|Open Source|Artificial Intelligence|GitHub","2023-11-28T15:50:02Z","91","32","https://www.producthunt.com/r/4LXBWCV6UY3R3L?utm_campaign=producthunt-api&utm_medium=api-v2&utm_source=Application%3A+RL+search+%28ID%3A+290620%29","https://www.producthunt.com/products/008/launches/008?utm_campaign=producthunt-api&utm_medium=api-v2&utm_source=Application%3A+RL+search+%28ID%3A+290620%29"
"427393","GlossAi","Make it short","GlossAi is an AI-driven content platform that allows organizations to rapidly create multi-audience content by repurposing existing raw footage into storified, audience-capturing content using generative AI capabilities.","Social Media|Marketing|Artificial Intelligence","2023-11-28T14:31:23Z","1","2","https://www.producthunt.com/r/UXVXAYIZRF4NXV?utm_campaign=producthunt-api&utm_medium=api-v2&utm_source=Application%3A+RL+search+%28ID%3A+290620%29","https://www.producthunt.com/products/glossai/launches/glossai?utm_campaign=producthunt-api&utm_medium=api-v2&utm_source=Application%3A+RL+search+%28ID%3A+290620%29"
"427381","Palette Immo","Batch Render AI-Powered Interior Redesigns & Virtual Staging","Offering Virtual Staging for empty spaces and Redesigns for furnished rooms. Save time and money with batch rendering and experience over 30 different styles. Share your page with a QR-code and personalize it with your brand. Start with 50 FREE credits!","Artificial Intelligence|Home improvement|Interior design","2023-11-28T13:49:38Z","3","5","https://www.producthunt.com/r/FJOD5GYMFA23A7?utm_campaign=producthunt-api&utm_medium=api-v2&utm_source=Application%3A+RL+search+%28ID%3A+290620%29","https://www.producthunt.com/products/palette-immo/launches/palette-immo?utm_campaign=producthunt-api&utm_medium=api-v2&utm_source=Application%3A+RL+search+%28ID%3A+290620%29"
"427374","MoodScape AI","AI wallpapers that change with the mood of the weather.","Try a new type of desktop wallpaper & lock screen with MoodScape AI. The app uses AI models that speak to one another to craft wallpapers that aren't just visually stunning but also dynamically reflective of the weather around you.","Weather|Artificial Intelligence|Wallpaper","2023-11-28T12:50:07Z","2","2","https://www.producthunt.com/r/KGVRPHHLYJMAKI?utm_campaign=producthunt-api&utm_medium=api-v2&utm_source=Application%3A+RL+search+%28ID%3A+290620%29","https://www.producthunt.com/products/moodscape-ai/launches/moodscape-ai?utm_campaign=producthunt-api&utm_medium=api-v2&utm_source=Application%3A+RL+search+%28ID%3A+290620%29"
"427285","Pika","Idea-to-video platform that brings your creativity to motion","Pika is an AI video platform that allows anyone to bring their creative vision to life. Through a state-of-the-art-video foundational model and a creation product that is effortless and accessible to everyone, Pika is redesigning how videos are made & edited.","Art|Artificial Intelligence|Video","2023-11-28T12:23:52Z","334","44","https://www.producthunt.com/r/3BYMKH4AX7FGSQ?utm_campaign=producthunt-api&utm_medium=api-v2&utm_source=Application%3A+RL+search+%28ID%3A+290620%29","https://www.producthunt.com/products/pika-2/launches/pika-3?utm_campaign=producthunt-api&utm_medium=api-v2&utm_source=Application%3A+RL+search+%28ID%3A+290620%29"
"427365","GPT Image To Code","Convert your UIs into HTML/CSS or JSX code.","Meet GPT Image to Code – your coding buddy with GPT magic! Easily turn your ideas into HTML, CSS, and JSX using simple images. It's coding made super easy!","Developer Tools|Artificial Intelligence|Web Design","2023-11-28T11:52:19Z","1","4","https://www.producthunt.com/r/UDJCOU36IYMMY7?utm_campaign=producthunt-api&utm_medium=api-v2&utm_source=Application%3A+RL+search+%28ID%3A+290620%29","https://www.producthunt.com/products/gpt-image-to-code/launches/gpt-image-to-code?utm_campaign=producthunt-api&utm_medium=api-v2&utm_source=Application%3A+RL+search+%28ID%3A+290620%29"
"427355","ChatGPT PromptMaster","Crafting Precision AI Prompts Made Easy!","Unveil the full potential of ChatGPT with PromptMaster! A unique, iterative prompt tool for tailored AI interactions - ideal for content creation, coding, and more. Try it now, 7 days money-back guaranteed!","Productivity|Artificial Intelligence|Tech","2023-11-28T11:04:50Z","1","1","https://www.producthunt.com/r/LBIEZ65R5NJYR6?utm_campaign=producthunt-api&utm_medium=api-v2&utm_source=Application%3A+RL+search+%28ID%3A+290620%29","https://www.producthunt.com/products/chatgpt-promptmaster/launches/chatgpt-promptmaster?utm_campaign=producthunt-api&utm_medium=api-v2&utm_source=Application%3A+RL+search+%28ID%3A+290620%29"
"427278","Stepsize AI","GenAI Product Development Reports","Stepsize uses GenAI to automatically create stunning and digestible updates about your product development. It intelligently analyzes project data from Jira or Linear, so you can keep all of your stakeholders up-to-date without lifting a finger.","Software Engineering|Developer Tools|Artificial Intelligence","2023-11-28T10:00:23Z","104","14","https://www.producthunt.com/r/OBYVO2TGDLUKWS?utm_campaign=producthunt-api&utm_medium=api-v2&utm_source=Application%3A+RL+search+%28ID%3A+290620%29","https://www.producthunt.com/products/stepsize/launches/stepsize-ai?utm_campaign=producthunt-api&utm_medium=api-v2&utm_source=Application%3A+RL+search+%28ID%3A+290620%29"
"426052","axcent","Collaborative AI Writing, Blogging and Communications Space","Collaborative AI enhanced writing, brainstorming, blog creation/publishing and communications space for teams and individuals. A True all-in-one tool.","Productivity|Writing|Artificial Intelligence","2023-11-28T08:50:32Z","89","15","https://www.producthunt.com/r/32UZDGL7RJRKON?utm_campaign=producthunt-api&utm_medium=api-v2&utm_source=Application%3A+RL+search+%28ID%3A+290620%29","https://www.producthunt.com/products/axcent/launches/axcent?utm_campaign=producthunt-api&utm_medium=api-v2&utm_source=Application%3A+RL+search+%28ID%3A+290620%29"
"410710","Venture Matching","Tinder for venture capital","AI-based Predictive Investments and Venture Matching platform. We provide a hot intro for the best deals of startups and VCs based on 26 parameters. Add a startup or VC website and select the best match from the PI list. We'll connect the pair by email.","Venture Capital|Artificial Intelligence|Fundraising","2023-11-28T08:49:54Z","292","105","https://www.producthunt.com/r/ZAE7G2JFX444QF?utm_campaign=producthunt-api&utm_medium=api-v2&utm_source=Application%3A+RL+search+%28ID%3A+290620%29","https://www.producthunt.com/products/predictive-investments-by-parsers-vc/launches/venture-matching?utm_campaign=producthunt-api&utm_medium=api-v2&utm_source=Application%3A+RL+search+%28ID%3A+290620%29"
"426449","StoriesOnBoard AI User Story Generator","Write excellent user stories with AI assistance","AI is a game changer, so why don’t you start your project with AI assistance? Save time and effort by building a backlog in seconds. Generate user stories, and acceptance criteria, and write release summaries with StoriesOnBoard’s new and powerful AI feature.","SaaS|Software Engineering|Artificial Intelligence","2023-11-28T08:46:19Z","104","27","https://www.producthunt.com/r/WJZJXNKGC3T5GX?utm_campaign=producthunt-api&utm_medium=api-v2&utm_source=Application%3A+RL+search+%28ID%3A+290620%29","https://www.producthunt.com/products/storiesonboard/launches/storiesonboard-ai-user-story-generator?utm_campaign=producthunt-api&utm_medium=api-v2&utm_source=Application%3A+RL+search+%28ID%3A+290620%29"
"427207","SVG.io","Text prompt to SVG illustration","Discover the power of AI with our Free Text-to-SVG Generator! Effortlessly convert your text prompts into stunning SVG images. Coming features: - New models - Categories - Multiple results from all categories","Internet of Things|Artificial Intelligence|Illustration","2023-11-28T08:44:40Z","148","48","https://www.producthunt.com/r/TP3DL4LK766ZZA?utm_campaign=producthunt-api&utm_medium=api-v2&utm_source=Application%3A+RL+search+%28ID%3A+290620%29","https://www.producthunt.com/products/svg-io/launches/svg-io?utm_campaign=producthunt-api&utm_medium=api-v2&utm_source=Application%3A+RL+search+%28ID%3A+290620%29"
"427311","Lycris.io","Create song lyrics with AI","Create anomalous lirycs with AI, this product bring you the oportunity to discover a lot of genders with a simple description and a title. It's simple. Besides, you can buy lyrics rights in a marketplace with a lot of genders and different thems.","Music|Artificial Intelligence","2023-11-28T08:44:04Z","101","16","https://www.producthunt.com/r/MDKWID6O7DXAS7?utm_campaign=producthunt-api&utm_medium=api-v2&utm_source=Application%3A+RL+search+%28ID%3A+290620%29","https://www.producthunt.com/products/lycris-io/launches/lycris-io?utm_campaign=producthunt-api&utm_medium=api-v2&utm_source=Application%3A+RL+search+%28ID%3A+290620%29"
"426257","BounceBan GPT","A custom ChatGPT for unlimited free email verifications","A custom ChatGPT powered by BounceBan, the only email verification service that supports catch-all email verification. Verify unlimited single or bulk emails for free directly within ChatGPT.","Productivity|Email Marketing|Artificial Intelligence","2023-11-28T08:42:43Z","183","109","https://www.producthunt.com/r/2EWHGPN7KF4AZE?utm_campaign=producthunt-api&utm_medium=api-v2&utm_source=Application%3A+RL+search+%28ID%3A+290620%29","https://www.producthunt.com/products/bounceban-gpt/launches/bounceban-gpt?utm_campaign=producthunt-api&utm_medium=api-v2&utm_source=Application%3A+RL+search+%28ID%3A+290620%29"
"427308","E-commerce Image Translation","Translate any product image into 100+ languages，FREE!","GhostCut Image Translation is a free Artificial Intelligence image translation software that works like a professional designer and translator, instantly localizing your images into over 100 languages with just one click.","Productivity|SaaS|Artificial Intelligence","2023-11-28T08:40:16Z","108","21","https://www.producthunt.com/r/73B7U3TRJSO25Q?utm_campaign=producthunt-api&utm_medium=api-v2&utm_source=Application%3A+RL+search+%28ID%3A+290620%29","https://www.producthunt.com/products/ghostcut/launches/e-commerce-image-translation?utm_campaign=producthunt-api&utm_medium=api-v2&utm_source=Application%3A+RL+search+%28ID%3A+290620%29"
"427292","Dream Oracles","Interpret and understand your dreams","Engage in insightful conversations about your dreams with professional dream interpreters. You can speak to our digital embodiment of Carl Jung and Sigmund Freud, or interact with one of our uniquely crafted fictional characters.","Artificial Intelligence|Health|Spirituality","2023-11-28T08:39:39Z","90","18","https://www.producthunt.com/r/73Y4UTJXFGPTOV?utm_campaign=producthunt-api&utm_medium=api-v2&utm_source=Application%3A+RL+search+%28ID%3A+290620%29","https://www.producthunt.com/products/dream-oracles/launches/dream-oracles?utm_campaign=producthunt-api&utm_medium=api-v2&utm_source=Application%3A+RL+search+%28ID%3A+290620%29"
"427231","Bedtime Bot","Build a rock solid relationship with your child","Spending 10 to 15 minutes reading bedtime stories helps to build a rock solid parent-child bond This will open a very special door into your child's mind, that gives you the ability to teach values and bond like nothing else Bedtime Bot makes this effortless","Parenting|Artificial Intelligence|Kids & Parenting","2023-11-28T08:38:50Z","90","12","https://www.producthunt.com/r/TO6VQ4SN3Y7OAT?utm_campaign=producthunt-api&utm_medium=api-v2&utm_source=Application%3A+RL+search+%28ID%3A+290620%29","https://www.producthunt.com/products/bedtime-bot/launches/bedtime-bot?utm_campaign=producthunt-api&utm_medium=api-v2&utm_source=Application%3A+RL+search+%28ID%3A+290620%29"
