"428986","AIHumanize.com","Transform AI Texts into Natural, Human-Like Content","AI humanizer ensures your AI content passes as human-written, perfect for bypassing AI detectors. Try it for seamless, natural results.","Writing|SEO|Artificial Intelligence","2023-12-08T20:01:00Z","5","0","https://www.producthunt.com/r/LRUEBBBG6FBTCO?utm_campaign=producthunt-api&utm_medium=api-v2&utm_source=Application%3A+RL+search+%28ID%3A+290620%29","https://www.producthunt.com/products/aihumanize-com/launches/aihumanize-com?utm_campaign=producthunt-api&utm_medium=api-v2&utm_source=Application%3A+RL+search+%28ID%3A+290620%29"
"428985","Drop Your AI","Ai tool directory website","DropYourAI is a project working passionately to bring you a cutting-edge library experience powered by artificial intelligence. Our goal is to collect all the valuable AI tools and resources available and make them easily accessible to users like you.","Productivity|Artificial Intelligence|Tech","2023-12-08T19:17:35Z","2","1","https://www.producthunt.com/r/2DMRBUUU3R3ORZ?utm_campaign=producthunt-api&utm_medium=api-v2&utm_source=Application%3A+RL+search+%28ID%3A+290620%29","https://www.producthunt.com/products/drop-your-ai/launches/drop-your-ai?utm_campaign=producthunt-api&utm_medium=api-v2&utm_source=Application%3A+RL+search+%28ID%3A+290620%29"
"428778","CopilotKit","Open-source platform for in-app AI chatbots and AI Textareas","The open-source Copilot platform. Featuring <𝐂𝐨𝐩𝐢𝐥𝐨𝐭𝐏𝐨𝐫𝐭𝐚𝐥 /> for in-app AI chatbots that can ""see"" and act in your app, and <𝐂𝐨𝐩𝐢𝐥𝐨𝐭𝐓𝐞𝐱𝐭𝐚𝐫𝐞𝐚 /> to bring AI-writing to any textarea. For devs, by devs with love❤️","Open Source|Artificial Intelligence|Development","2023-12-08T15:34:22Z","254","85","https://www.producthunt.com/r/T2JLBWEDXDXT4X?utm_campaign=producthunt-api&utm_medium=api-v2&utm_source=Application%3A+RL+search+%28ID%3A+290620%29","https://www.producthunt.com/products/copilotkit/launches/copilotkit?utm_campaign=producthunt-api&utm_medium=api-v2&utm_source=Application%3A+RL+search+%28ID%3A+290620%29"
"428669","Depth Tale","A modern interactive story builder for generative AI assets","Deph Tale brings interactive storytelling for everyone. Discover the community's tales, join and participate in stories in the making, or get inspired and make your dream adventure.","Art|Adventure Games|Artificial Intelligence","2023-12-08T11:03:52Z","114","26","https://www.producthunt.com/r/H4AMG6NPHJDXS2?utm_campaign=producthunt-api&utm_medium=api-v2&utm_source=Application%3A+RL+search+%28ID%3A+290620%29","https://www.producthunt.com/products/depth-tale/launches/depth-tale?utm_campaign=producthunt-api&utm_medium=api-v2&utm_source=Application%3A+RL+search+%28ID%3A+290620%29"
"419889","NeoAnalyst","AI data analyst for business leaders","NeoAnalyst.AI revolutionizes data analysis, making profound insights intuitive for all. Simply upload data and choose from 25 recommended questions to receive astute visualizations and actionable insights. No coding or data science knowledge required.","Productivity|Analytics|Artificial Intelligence","2023-12-08T11:03:30Z","25","6","https://www.producthunt.com/r/TO42XUKPO3LKAA?utm_campaign=producthunt-api&utm_medium=api-v2&utm_source=Application%3A+RL+search+%28ID%3A+290620%29","https://www.producthunt.com/products/neoanalyst/launches/neoanalyst?utm_campaign=producthunt-api&utm_medium=api-v2&utm_source=Application%3A+RL+search+%28ID%3A+290620%29"
"428931","BigRead.ai","Read and Learn anything  with personalized AI Tutor","Meet BigRead: your personalized AI tutor. 1. An interactive way to start reading & Learning.BigRead uses the Socratic method to promote critical thinking. 2. BigRead is a fully adaptive AI tutor experience. Designed to make reading fun and effective.","User Experience|Education|Artificial Intelligence","2023-12-08T11:01:36Z","101","27","https://www.producthunt.com/r/IVBTB7NXSQNK4F?utm_campaign=producthunt-api&utm_medium=api-v2&utm_source=Application%3A+RL+search+%28ID%3A+290620%29","https://www.producthunt.com/products/bigread/launches/bigread-ai?utm_campaign=producthunt-api&utm_medium=api-v2&utm_source=Application%3A+RL+search+%28ID%3A+290620%29"
"428936","Bottomright AI","AI chatbot that trains itself on your website","Meet Bottomright — the AI powered chatbot that trains itself by crawling your website. Add it to yours in minutes and put customer support on autopilot.","Customer Communication|Artificial Intelligence|Bots","2023-12-08T11:01:13Z","94","20","https://www.producthunt.com/r/44SFDM2ZZLSG5J?utm_campaign=producthunt-api&utm_medium=api-v2&utm_source=Application%3A+RL+search+%28ID%3A+290620%29","https://www.producthunt.com/products/bottomright-ai/launches/bottomright-ai?utm_campaign=producthunt-api&utm_medium=api-v2&utm_source=Application%3A+RL+search+%28ID%3A+290620%29"
"428925","Sonar Profiler","Find Target's Tech Strengths Early in the Investment Process","Sonar Profiler is an automated software assessing technology strengths and weaknesses before the investment process. No access to target is needed - we use data from public sources together with proprietary algorithms to build the technology profile.","Investing|Artificial Intelligence|Finance","2023-12-08T09:39:08Z","2","0","https://www.producthunt.com/r/GKJZMR4BZIZ65O?utm_campaign=producthunt-api&utm_medium=api-v2&utm_source=Application%3A+RL+search+%28ID%3A+290620%29","https://www.producthunt.com/products/sonar-profiler/launches/sonar-profiler?utm_campaign=producthunt-api&utm_medium=api-v2&utm_source=Application%3A+RL+search+%28ID%3A+290620%29"
"428919","7Assets","Manage all finances & assets in one place with AI","7Assets is a smart digital organizer for your money and things you own, like stocks or a house. AI helps you keep track easily. It doesn't sell any financial products or give you financial advice. It's a tool to help you see and manage your own stuff.","Artificial Intelligence|Personal Finance|Budgeting","2023-12-08T09:01:00Z","2","1","https://www.producthunt.com/r/JYDI2PLQZPLXB6?utm_campaign=producthunt-api&utm_medium=api-v2&utm_source=Application%3A+RL+search+%28ID%3A+290620%29","https://www.producthunt.com/products/7assets/launches/7assets?utm_campaign=producthunt-api&utm_medium=api-v2&utm_source=Application%3A+RL+search+%28ID%3A+290620%29"
"428879","Cold Mail Bot","AI writes and sends cold emails","With AI, our tool writes each email specially for the person you're sending it to and then sends it out, just like having an extra helper who's really good at emails.","Sales|Email Marketing|Artificial Intelligence","2023-12-08T08:31:49Z","131","29","https://www.producthunt.com/r/HK4LOYL7DGYK3T?utm_campaign=producthunt-api&utm_medium=api-v2&utm_source=Application%3A+RL+search+%28ID%3A+290620%29","https://www.producthunt.com/products/cold-mail-bot/launches/cold-mail-bot?utm_campaign=producthunt-api&utm_medium=api-v2&utm_source=Application%3A+RL+search+%28ID%3A+290620%29"
"428888","Imagine with Meta AI","Meta's answer to Midjourney, now on the web","Imagine with Meta AI is standalone experience that lets creative hobbyists create images with technology from Emu, Meta's image foundation model.","Design Tools|Art|Artificial Intelligence","2023-12-08T08:01:00Z","205","31","https://www.producthunt.com/r/W6JOCW7PKYMFFE?utm_campaign=producthunt-api&utm_medium=api-v2&utm_source=Application%3A+RL+search+%28ID%3A+290620%29","https://www.producthunt.com/products/meta/launches/imagine-with-meta-ai?utm_campaign=producthunt-api&utm_medium=api-v2&utm_source=Application%3A+RL+search+%28ID%3A+290620%29"
"428843","Agent M - Powered by Floatbot.AI","Generative AI powered Master Agent Developer Framework","Agent M is a powerful LLM based Master Agent developer framework, that lets you create multiple LLM based Agents, that can do natural language-based interaction over your document or data or application.","Artificial Intelligence","2023-12-08T08:01:00Z","277","88","https://www.producthunt.com/r/SETJ6VEMQQDST3?utm_campaign=producthunt-api&utm_medium=api-v2&utm_source=Application%3A+RL+search+%28ID%3A+290620%29","https://www.producthunt.com/products/floatbot-2/launches/agent-m-powered-by-floatbot-ai-2?utm_campaign=producthunt-api&utm_medium=api-v2&utm_source=Application%3A+RL+search+%28ID%3A+290620%29"
"427503","Interview Copilot by Final Round AI","Delivering interview answers in real-time","Final Round AI creates Interview Copilot®️ providing real-time transcription and contextual assistance ON-THE-FLY during online interviews. Additionally, a suite of superpower AI tools helps candidates excel in this challenging recruiting season.","SaaS|Artificial Intelligence|Career","2023-12-08T08:01:00Z","296","146","https://www.producthunt.com/r/KDGDA7WWRJ7LDH?utm_campaign=producthunt-api&utm_medium=api-v2&utm_source=Application%3A+RL+search+%28ID%3A+290620%29","https://www.producthunt.com/products/final-round-ai/launches/interview-copilot-by-final-round-ai?utm_campaign=producthunt-api&utm_medium=api-v2&utm_source=Application%3A+RL+search+%28ID%3A+290620%29"
"423747","Swiftbrief V2","All in one SEO platform: KW Research, KW Clustering, Briefs","Swiftbrief is the brief generation engine that helps you scale your SEO content with data.","Marketing|SEO|Artificial Intelligence","2023-12-08T08:01:00Z","91","67","https://www.producthunt.com/r/J6NGEXDFN3CVJZ?utm_campaign=producthunt-api&utm_medium=api-v2&utm_source=Application%3A+RL+search+%28ID%3A+290620%29","https://www.producthunt.com/products/swiftbrief/launches/swiftbrief-v2?utm_campaign=producthunt-api&utm_medium=api-v2&utm_source=Application%3A+RL+search+%28ID%3A+290620%29"
"428768","Visionati","Generate Tweets, Captions and Descriptions for your Images!","Visionati delivers comprehensive visual AI analysis, combining image captioning, detailed descriptions, and intelligent tagging. Powered by leading AI technologies for unparalleled accuracy and depth in digital marketing and data insights.","Marketing|Artificial Intelligence|Tech","2023-12-08T08:01:00Z","3","1","https://www.producthunt.com/r/GFIM6HOHBAZNYD?utm_campaign=producthunt-api&utm_medium=api-v2&utm_source=Application%3A+RL+search+%28ID%3A+290620%29","https://www.producthunt.com/products/visionati/launches/visionati?utm_campaign=producthunt-api&utm_medium=api-v2&utm_source=Application%3A+RL+search+%28ID%3A+290620%29"
"428892","Crikk","Revolution In Text to Speech","Crikk is revolution text to speech. Crikk not only sounds better but it is affordable as well. Currently we are offering 6 natural sounding voices that can generate voiceover in 55 languages. We are also offering some less natural-sounding voices for free.","Productivity|Marketing|Artificial Intelligence","2023-12-08T08:01:00Z","9","6","https://www.producthunt.com/r/4UPJHJOQIHIPNK?utm_campaign=producthunt-api&utm_medium=api-v2&utm_source=Application%3A+RL+search+%28ID%3A+290620%29","https://www.producthunt.com/products/crikk/launches/crikk?utm_campaign=producthunt-api&utm_medium=api-v2&utm_source=Application%3A+RL+search+%28ID%3A+290620%29"
"428899","Pic A Pet Name","Generate Your Pet's Name from Their Photo","PicAPetName: An tool that suggests unique pet names based on your pet’s photo based on GPT-4V. Quick, fun, and personalized – perfect for your new furry, feathered, or scaly companion.","Funny|Pets|Artificial Intelligence","2023-12-08T08:01:00Z","3","3","https://www.producthunt.com/r/7SS5VEA73MV3CT?utm_campaign=producthunt-api&utm_medium=api-v2&utm_source=Application%3A+RL+search+%28ID%3A+290620%29","https://www.producthunt.com/products/pic-a-pet-name/launches/pic-a-pet-name?utm_campaign=producthunt-api&utm_medium=api-v2&utm_source=Application%3A+RL+search+%28ID%3A+290620%29"
"428824","Code Gen GPTs for iOS Devs","Based on Apple's most popular frameworks and app services.","I made 13 framework specific code-gen GPT's for iOS devs: SwiftUI, Foundation, MapKit, CoreData, ActivityKit, EventKit, CoreML, Combine, SwiftData, CloudKit & More","iOS|Artificial Intelligence|Apple","2023-12-08T08:01:00Z","1","1","https://www.producthunt.com/r/OOHEEHNLJZQQ7Q?utm_campaign=producthunt-api&utm_medium=api-v2&utm_source=Application%3A+RL+search+%28ID%3A+290620%29","https://www.producthunt.com/products/code-gen-gpts-for-ios-devs/launches/code-gen-gpts-for-ios-devs?utm_campaign=producthunt-api&utm_medium=api-v2&utm_source=Application%3A+RL+search+%28ID%3A+290620%29"
"428872","DigitBridge","All-in-one omnichannel solution for Wholesaler and Retailer.","The only affordable, all-in-one operational solution for omnichannel wholesalers and retailers. DigitBridge gives you the tools you need for B2B, B2C, and B2B2C digital commerce operations at a fraction of the cost of existing solutions.","SaaS|Artificial Intelligence|E-Commerce","2023-12-08T08:01:00Z","2","1","https://www.producthunt.com/r/NA26J63HGYBZGU?utm_campaign=producthunt-api&utm_medium=api-v2&utm_source=Application%3A+RL+search+%28ID%3A+290620%29","https://www.producthunt.com/products/digitbridge/launches/digitbridge?utm_campaign=producthunt-api&utm_medium=api-v2&utm_source=Application%3A+RL+search+%28ID%3A+290620%29"
"428870","Prompters","🚀 Community of AI Users: Premium Prompts [+] Training","Prompters is your toolbox for generative AI. A community where you'll find customizable premium prompts, tailored to your needs. It offers practical micro-trainings and access to a private group to share opinions and connect with other AI enthusiasts.🧠✨","Artificial Intelligence|Community","2023-12-08T08:01:00Z","3","1","https://www.producthunt.com/r/Y3Q4FQVCS5UX2U?utm_campaign=producthunt-api&utm_medium=api-v2&utm_source=Application%3A+RL+search+%28ID%3A+290620%29","https://www.producthunt.com/products/prompters/launches/prompters?utm_campaign=producthunt-api&utm_medium=api-v2&utm_source=Application%3A+RL+search+%28ID%3A+290620%29"
"428655","Translate This Video","Auto Translation and Dubbing that works.","We convert your English-speaking videos to over a dozen languages so you can share your content with the world. And it sounds just like you!","Languages|Artificial Intelligence|Video","2023-12-08T08:01:00Z","12","1","https://www.producthunt.com/r/7IF62MFJHRR6BC?utm_campaign=producthunt-api&utm_medium=api-v2&utm_source=Application%3A+RL+search+%28ID%3A+290620%29","https://www.producthunt.com/products/translate-this-video/launches/translate-this-video?utm_campaign=producthunt-api&utm_medium=api-v2&utm_source=Application%3A+RL+search+%28ID%3A+290620%29"
"428775","ZMO - AI Fashion Model","Showcase clothing on various models endless scenes instantly","Turn your ordinary photos into high-quality studio images and customize models and backgrounds to match your desired audience. ZMO showcase your product on actual models instead of mannequins with 10x faster time to market and higher conversion.","Photography|Artificial Intelligence|E-Commerce","2023-12-08T08:01:00Z","3","5","https://www.producthunt.com/r/BFGT5LSPZRZNW6?utm_campaign=producthunt-api&utm_medium=api-v2&utm_source=Application%3A+RL+search+%28ID%3A+290620%29","https://www.producthunt.com/products/zmo-ai-fashion-model/launches/zmo-ai-fashion-model?utm_campaign=producthunt-api&utm_medium=api-v2&utm_source=Application%3A+RL+search+%28ID%3A+290620%29"
"428851","freeAItool","Free AI Tools Directory - Discover a World of Free AI Tools","Explore the vast collection of free AI tools in our directory. Find the best AI solutions for your needs and boost your projects with our curated selection of AI tools and resources.","Artificial Intelligence|Bots|Maker Tools","2023-12-08T08:01:00Z","55","26","https://www.producthunt.com/r/HCYVW22YMBJTCT?utm_campaign=producthunt-api&utm_medium=api-v2&utm_source=Application%3A+RL+search+%28ID%3A+290620%29","https://www.producthunt.com/products/freeaitool/launches/freeaitool?utm_campaign=producthunt-api&utm_medium=api-v2&utm_source=Application%3A+RL+search+%28ID%3A+290620%29"
"428908","ChatAIr","OpenAI API Client For macOS","ChatAIr is an exclusive OpenAI API client for macOS. We support managing prompts and invoking the OpenAI API through a customized command set in the same chat window, helping you to use the most powerful AI models to date more conveniently and efficiently.","Productivity|Artificial Intelligence|Menu Bar Apps","2023-12-08T08:01:00Z","2","1","https://www.producthunt.com/r/LPFQSRFDKVZYWN?utm_campaign=producthunt-api&utm_medium=api-v2&utm_source=Application%3A+RL+search+%28ID%3A+290620%29","https://www.producthunt.com/products/chatair/launches/chatair?utm_campaign=producthunt-api&utm_medium=api-v2&utm_source=Application%3A+RL+search+%28ID%3A+290620%29"
"426108","Outboundly.ai","AI-powered cold outreach platform","Outboundly.ai ensures your emails are friendly, get noticed, and are super effective at scale. With a dash of AI, we’re providing unlimited email capabilities, and generating email sequences with a single click, ensuring your messages truly land and resonate.","Email Marketing|Marketing|Artificial Intelligence","2023-12-08T08:01:00Z","194","29","https://www.producthunt.com/r/7XT4DDQBUWGUTG?utm_campaign=producthunt-api&utm_medium=api-v2&utm_source=Application%3A+RL+search+%28ID%3A+290620%29","https://www.producthunt.com/products/outboundly-ai/launches/outboundly-ai?utm_campaign=producthunt-api&utm_medium=api-v2&utm_source=Application%3A+RL+search+%28ID%3A+290620%29"
"428696","CostGPT","Calculate cost & timeline for software development using AI","CostGPT is an AI-powered software cost estimator that swiftly generates detailed feature breakdowns and close-to-accurate cost estimates for your software ideas, simplifying the process in a few clicks","Productivity|Artificial Intelligence|Tech","2023-12-08T08:01:00Z","109","108","https://www.producthunt.com/r/6OHVEBJH2JKYEE?utm_campaign=producthunt-api&utm_medium=api-v2&utm_source=Application%3A+RL+search+%28ID%3A+290620%29","https://www.producthunt.com/products/costgpt/launches/costgpt?utm_campaign=producthunt-api&utm_medium=api-v2&utm_source=Application%3A+RL+search+%28ID%3A+290620%29"
"428529","Flux","ChatGPT for hardware","Flux is a browser based app for designing circuits and PCBs with a built-in AI assistant called Flux Copilot. It’s meticulously designed, incredibly fast, and is built from the ground up to enable agile hardware development.","Design Tools|Hardware|Artificial Intelligence","2023-12-08T08:01:00Z","250","52","https://www.producthunt.com/r/A7TXIN6RFPZBP5?utm_campaign=producthunt-api&utm_medium=api-v2&utm_source=Application%3A+RL+search+%28ID%3A+290620%29","https://www.producthunt.com/products/flux-10/launches/flux-c27640a9-3284-4d5d-962f-0f088ad9ef4b?utm_campaign=producthunt-api&utm_medium=api-v2&utm_source=Application%3A+RL+search+%28ID%3A+290620%29"
"427451","Vizard","Repurpose any long video into 10+ viral shorts instantly","Automatically create captivating clips from podcasts, webinars, or any talking head videos designed for TikTok, Shorts, Reels, and more! Edit, caption, and auto-publish with a single click. Save hours on editing and see your social accounts grow.","Social Media|Marketing|Artificial Intelligence","2023-12-08T08:01:00Z","188","76","https://www.producthunt.com/r/BO34RPEJNMQV7Q?utm_campaign=producthunt-api&utm_medium=api-v2&utm_source=Application%3A+RL+search+%28ID%3A+290620%29","https://www.producthunt.com/products/vizard-ai/launches/vizard?utm_campaign=producthunt-api&utm_medium=api-v2&utm_source=Application%3A+RL+search+%28ID%3A+290620%29"
"428900","Ramayan Quest","Generative AI chat for the Ramayan's english translation","The Ramayan is one of India's oldest texts. I took various English translations of the Ramayan, and added generative AI capabilities on top of it.","Education|Artificial Intelligence|Books","2023-12-08T08:01:00Z","3","1","https://www.producthunt.com/r/IO73BHG2CEDVOD?utm_campaign=producthunt-api&utm_medium=api-v2&utm_source=Application%3A+RL+search+%28ID%3A+290620%29","https://www.producthunt.com/products/ramayan-quest/launches/ramayan-quest?utm_campaign=producthunt-api&utm_medium=api-v2&utm_source=Application%3A+RL+search+%28ID%3A+290620%29"
"428479","Funny AI","You can find funny AI apps here, like a playground","You can find funny AI application at funnyai.store We launch our first product with background surprise","Design Tools|Photography|Artificial Intelligence","2023-12-08T08:01:00Z","5","0","https://www.producthunt.com/r/33GBIKHKJCC3UI?utm_campaign=producthunt-api&utm_medium=api-v2&utm_source=Application%3A+RL+search+%28ID%3A+290620%29","https://www.producthunt.com/products/funny-ai/launches/funny-ai?utm_campaign=producthunt-api&utm_medium=api-v2&utm_source=Application%3A+RL+search+%28ID%3A+290620%29"
"428862","Forma","Get expert feedback on your running form","Upload a running video to get free professional running form feedback powered by AI and expert coaches.","Health & Fitness|Artificial Intelligence|Running","2023-12-08T08:01:00Z","3","1","https://www.producthunt.com/r/C6L6U5DKF4RIJZ?utm_campaign=producthunt-api&utm_medium=api-v2&utm_source=Application%3A+RL+search+%28ID%3A+290620%29","https://www.producthunt.com/products/forma-3/launches/forma-da109bea-6323-4c27-9cc6-c723c8c1a5f9?utm_campaign=producthunt-api&utm_medium=api-v2&utm_source=Application%3A+RL+search+%28ID%3A+290620%29"
"428686","FinBo","Simpler, Smarter, Stress-Free. Your Smart Financial Advisor","Revolutionizing home loans in India, Finansh introduces FinBo: an advanced Robo Advisory tool that recommends options with 100% precision. FinBo simplifies loan selection with smart, tailored algorithms, making the journey to homeownership stress-free.","Home|Fintech|Artificial Intelligence","2023-12-08T08:01:00Z","3","1","https://www.producthunt.com/r/V4YDWEBMZIGGBW?utm_campaign=producthunt-api&utm_medium=api-v2&utm_source=Application%3A+RL+search+%28ID%3A+290620%29","https://www.producthunt.com/products/finbo/launches/finbo?utm_campaign=producthunt-api&utm_medium=api-v2&utm_source=Application%3A+RL+search+%28ID%3A+290620%29"
"428705","OctiAI V2","AI prompt generator","AI prompt generator specifically designed for ChatGPT, Mid Journey, and other diverse content creation AI models. Its main goal is to enhance creativity and improve results through the use of image and text-based prompts landing page: https://www.octiai.com/","Design Tools|Artificial Intelligence|Bots","2023-12-08T08:01:00Z","4","1","https://www.producthunt.com/r/5RYWVFCYSCM6IX?utm_campaign=producthunt-api&utm_medium=api-v2&utm_source=Application%3A+RL+search+%28ID%3A+290620%29","https://www.producthunt.com/products/octiai-v2/launches/octiai-v2?utm_campaign=producthunt-api&utm_medium=api-v2&utm_source=Application%3A+RL+search+%28ID%3A+290620%29"
"425246","CleverCharts","Making Data Analytics Understandable and Accessible.","CleverCharts AI: Transform data into insights with AI-assisted analytics. Intuitive, powerful, and perfect for non-techies. Dive into data stories easily, make smarter decisions swiftly!","Analytics|Artificial Intelligence|Tech","2023-12-08T08:01:00Z","3","1","https://www.producthunt.com/r/TCKGNPXDLNTTOM?utm_campaign=producthunt-api&utm_medium=api-v2&utm_source=Application%3A+RL+search+%28ID%3A+290620%29","https://www.producthunt.com/products/clevercharts/launches/clevercharts?utm_campaign=producthunt-api&utm_medium=api-v2&utm_source=Application%3A+RL+search+%28ID%3A+290620%29"
"428877","Local Buddy","An Ai guide in your pocket to any location, city, or space","AI-powered app designed to give you insight into local favorites for any place on earth. Going on a 3-day trip to Punta Leona, Costa Rica? Local buddy will find unique places to eat and explore","Travel|Artificial Intelligence|Vacation","2023-12-07T21:48:02Z","1","1","https://www.producthunt.com/r/B47ILI2F67QBPJ?utm_campaign=producthunt-api&utm_medium=api-v2&utm_source=Application%3A+RL+search+%28ID%3A+290620%29","https://www.producthunt.com/products/local-buddy/launches/local-buddy?utm_campaign=producthunt-api&utm_medium=api-v2&utm_source=Application%3A+RL+search+%28ID%3A+290620%29"
"428866","Scourz","Real-time Business Lead Search and Notification","Real-time business lead search of local groups and platforms using keywords. Business notification via text.","Social Media|Marketing|Artificial Intelligence","2023-12-07T20:01:17Z","2","2","https://www.producthunt.com/r/H74PBVYKQRVUM4?utm_campaign=producthunt-api&utm_medium=api-v2&utm_source=Application%3A+RL+search+%28ID%3A+290620%29","https://www.producthunt.com/products/scourz/launches/scourz?utm_campaign=producthunt-api&utm_medium=api-v2&utm_source=Application%3A+RL+search+%28ID%3A+290620%29"
"428847","Golain","Your co-pilot for IoT","Craft your own IoT platform with Golain, no coding or external services needed. Upgrade your Hardware MVP to a market-ready product in 2 weeks. Focus on the hard parts: The HARDware, let us take care of the rest.","Internet of Things|Developer Tools|Artificial Intelligence","2023-12-07T17:01:00Z","4","1","https://www.producthunt.com/r/NOIRW4JGYAB4GJ?utm_campaign=producthunt-api&utm_medium=api-v2&utm_source=Application%3A+RL+search+%28ID%3A+290620%29","https://www.producthunt.com/products/golain/launches/golain?utm_campaign=producthunt-api&utm_medium=api-v2&utm_source=Application%3A+RL+search+%28ID%3A+290620%29"
"428834","Cybergod","Autonomous computer agent that can replace all human workers","Forget about anything computer related! Cybergod can do it all! Human history has evolved for so long that we are here at the internet era. We were stucked in the monitors for so long that it is time for a giant leap forward!","Productivity|Artificial Intelligence|GitHub","2023-12-07T13:50:45Z","1","1","https://www.producthunt.com/r/2L2E63KNRWNHUX?utm_campaign=producthunt-api&utm_medium=api-v2&utm_source=Application%3A+RL+search+%28ID%3A+290620%29","https://www.producthunt.com/products/cybergod/launches/cybergod?utm_campaign=producthunt-api&utm_medium=api-v2&utm_source=Application%3A+RL+search+%28ID%3A+290620%29"
